{"run":22,"commit":"340aa8c","metric":226.3180140613836,"metrics":{"BenchmarkDecodeBase58_ns_op":64.57,"BenchmarkDecodeBase58_B_op":0,"BenchmarkDecodeBase58_allocs_op":0,"BenchmarkEncodeBase58_ns_op":83.71,"BenchmarkEncodeBase58_B_op":24,"BenchmarkEncodeBase58_allocs_op":1,"BenchmarkEncodeDecodeBase58_ns_op":160.8,"BenchmarkEncodeDecodeBase58_B_op":24,"BenchmarkEncodeDecodeBase58_allocs_op":1,"BenchmarkFromTime_ns_op":66.25,"BenchmarkFromTime_B_op":0,"BenchmarkFromTime_allocs_op":0,"BenchmarkGenerateUUID_ns_op":587.2,"BenchmarkGenerateUUID_B_op":24,"BenchmarkGenerateUUID_allocs_op":1,"BenchmarkMainGenerate_ns_op":592.8,"BenchmarkMainGenerate_B_op":24,"BenchmarkMainGenerate_allocs_op":1,"BenchmarkMainHelp_ns_op":373.8,"BenchmarkMainHelp_B_op":0,"BenchmarkMainHelp_allocs_op":0,"BenchmarkMainParse_ns_op":741.9,"BenchmarkMainParse_B_op":0,"BenchmarkMainParse_allocs_op":0,"BenchmarkNewString_ns_op":195.5,"BenchmarkNewString_B_op":24,"BenchmarkNewString_allocs_op":1,"BenchmarkParseUUID_ns_op":742.8,"BenchmarkParseUUID_B_op":0,"BenchmarkParseUUID_allocs_op":0,"BenchmarkUUID7_ns_op":98.84,"BenchmarkUUID7_B_op":0,"BenchmarkUUID7_allocs_op":0},"status":"discard","description":"Manually store UUID timestamp field bytes instead of binary.BigEndian.PutUint64","timestamp":1782059756647,"segment":0,"confidence":8.239577735808764,"asi":{"hypothesis":"Manual byte stores for the first UUIDv7 64-bit field might avoid binary.BigEndian.PutUint64 overhead in FromTime/UUID7.","rollback_reason":"Correctness checks passed, but primary metric regressed and FromTime/UUID7 got slower; the standard BigEndian store is optimized better than explicit byte assignments here.","next_action_hint":"Keep binary.BigEndian.PutUint64 in FromTime. Timestamp arithmetic or random-read costs are more relevant than store mechanics."}}
{"run":23,"commit":"d24d8d9","metric":211.43698084513562,"metrics":{"BenchmarkDecodeBase58_ns_op":62.76,"BenchmarkDecodeBase58_B_op":0,"BenchmarkDecodeBase58_allocs_op":0,"BenchmarkEncodeBase58_ns_op":81.47,"BenchmarkEncodeBase58_B_op":24,"BenchmarkEncodeBase58_allocs_op":1,"BenchmarkEncodeDecodeBase58_ns_op":152.8,"BenchmarkEncodeDecodeBase58_B_op":24,"BenchmarkEncodeDecodeBase58_allocs_op":1,"BenchmarkFromTime_ns_op":65.02,"BenchmarkFromTime_B_op":0,"BenchmarkFromTime_allocs_op":0,"BenchmarkGenerateUUID_ns_op":586.2,"BenchmarkGenerateUUID_B_op":24,"BenchmarkGenerateUUID_allocs_op":1,"BenchmarkMainGenerate_ns_op":573.7,"BenchmarkMainGenerate_B_op":24,"BenchmarkMainGenerate_allocs_op":1,"BenchmarkMainHelp_ns_op":363.2,"BenchmarkMainHelp_B_op":0,"BenchmarkMainHelp_allocs_op":0,"BenchmarkMainParse_ns_op":589.5,"BenchmarkMainParse_B_op":0,"BenchmarkMainParse_allocs_op":0,"BenchmarkNewString_ns_op":192.7,"BenchmarkNewString_B_op":24,"BenchmarkNewString_allocs_op":1,"BenchmarkParseUUID_ns_op":549.8,"BenchmarkParseUUID_B_op":0,"BenchmarkParseUUID_allocs_op":0,"BenchmarkUUID7_ns_op":97.43,"BenchmarkUUID7_B_op":0,"BenchmarkUUID7_allocs_op":0},"status":"keep","description":"Format CLI parse timestamps with specialized append helper","timestamp":1782059864853,"segment":0,"confidence":7.777821453587083,"asi":{"hypothesis":"The CLI parse output uses a fixed timestamp layout; appending numeric date/time fields and the zone name directly should avoid time.AppendFormat's general formatter while preserving exact output, with fallback to time.AppendFormat for years outside 0..9999 and numeric-zone handling matching Go's MST layout.","learned":"Parse benchmarks improved substantially (~740ns to ~550-590ns) with zero allocations retained. The helper preserves general behavior for ordinary named zones and falls back for unusual years; empty zone names now emit +HHMM to match time.Format."}}
{"run":24,"commit":"d24d8d9","metric":231.2051822591143,"metrics":{"BenchmarkDecodeBase58_ns_op":63.96,"BenchmarkDecodeBase58_B_op":0,"BenchmarkDecodeBase58_allocs_op":0,"BenchmarkEncodeBase58_ns_op":120.2,"BenchmarkEncodeBase58_B_op":24,"BenchmarkEncodeBase58_allocs_op":1,"BenchmarkEncodeDecodeBase58_ns_op":191.7,"BenchmarkEncodeDecodeBase58_B_op":24,"BenchmarkEncodeDecodeBase58_allocs_op":1,"BenchmarkFromTime_ns_op":65.63,"BenchmarkFromTime_B_op":0,"BenchmarkFromTime_allocs_op":0,"BenchmarkGenerateUUID_ns_op":619,"BenchmarkGenerateUUID_B_op":24,"BenchmarkGenerateUUID_allocs_op":1,"BenchmarkMainGenerate_ns_op":619.9,"BenchmarkMainGenerate_B_op":24,"BenchmarkMainGenerate_allocs_op":1,"BenchmarkMainHelp_ns_op":366.2,"BenchmarkMainHelp_B_op":0,"BenchmarkMainHelp_allocs_op":0,"BenchmarkMainParse_ns_op":575.2,"BenchmarkMainParse_B_op":0,"BenchmarkMainParse_allocs_op":0,"BenchmarkNewString_ns_op":232.2,"BenchmarkNewString_B_op":24,"BenchmarkNewString_allocs_op":1,"BenchmarkParseUUID_ns_op":563.6,"BenchmarkParseUUID_B_op":0,"BenchmarkParseUUID_allocs_op":0,"BenchmarkUUID7_ns_op":98.64,"BenchmarkUUID7_B_op":0,"BenchmarkUUID7_allocs_op":0},"status":"discard","description":"Try two-limb Base58 encoder with bits.Div64","timestamp":1782059927174,"segment":0,"confidence":6.725543262936382,"asi":{"hypothesis":"Representing the UUID as two uint64 limbs and using bits.Div64 for the low limb might halve the number of divisions in EncodeBase58 versus four uint32 limbs.","rollback_reason":"Correctness passed, but EncodeBase58 slowed significantly (~82ns to ~120ns); bits.Div64/software 128-bit division is more expensive than four compiler-optimized constant 64-bit divisions by 58 on this platform.","next_action_hint":"Keep the four-uint32-limb encoder. Avoid bits.Div64 for this fixed small divisor unless a future platform-specific benchmark shows otherwise."}}
{"run":25,"commit":"88218f7","metric":206.26480373134518,"metrics":{"BenchmarkDecodeBase58_ns_op":56.09,"BenchmarkDecodeBase58_B_op":0,"BenchmarkDecodeBase58_allocs_op":0,"BenchmarkEncodeBase58_ns_op":82.41,"BenchmarkEncodeBase58_B_op":24,"BenchmarkEncodeBase58_allocs_op":1,"BenchmarkEncodeDecodeBase58_ns_op":146.4,"BenchmarkEncodeDecodeBase58_B_op":24,"BenchmarkEncodeDecodeBase58_allocs_op":1,"BenchmarkFromTime_ns_op":64.98,"BenchmarkFromTime_B_op":0,"BenchmarkFromTime_allocs_op":0,"BenchmarkGenerateUUID_ns_op":570.9,"BenchmarkGenerateUUID_B_op":24,"BenchmarkGenerateUUID_allocs_op":1,"BenchmarkMainGenerate_ns_op":567.7,"BenchmarkMainGenerate_B_op":24,"BenchmarkMainGenerate_allocs_op":1,"BenchmarkMainHelp_ns_op":364.1,"BenchmarkMainHelp_B_op":0,"BenchmarkMainHelp_allocs_op":0,"BenchmarkMainParse_ns_op":540.1,"BenchmarkMainParse_B_op":0,"BenchmarkMainParse_allocs_op":0,"BenchmarkNewString_ns_op":191.8,"BenchmarkNewString_B_op":24,"BenchmarkNewString_allocs_op":1,"BenchmarkParseUUID_ns_op":544.2,"BenchmarkParseUUID_B_op":0,"BenchmarkParseUUID_allocs_op":0,"BenchmarkUUID7_ns_op":98.29,"BenchmarkUUID7_B_op":0,"BenchmarkUUID7_allocs_op":0},"status":"keep","description":"Decode Base58 directly into four UUID limbs","timestamp":1782060033582,"segment":0,"confidence":5.37847643048706,"asi":{"hypothesis":"Because hqid7 input is fixed to 22 Base58 digits and the original decoder kept only the low 16 decoded bytes, DecodeBase58 can maintain only four uint32 UUID limbs and discard carry above 128 bits instead of updating six limbs and checking unreachable overflow conditions.","learned":"DecodeBase58 improved from ~63ns to ~56ns and encode-decode/parse improved. Correctness checks passed; 22 Base58 digits cannot exceed the old six-limb overflow thresholds, so removed overflow errors were not reachable for length-valid inputs."}}
{"run":26,"commit":"5c27e20","metric":181.9721237072296,"metrics":{"BenchmarkDecodeBase58_ns_op":21.27,"BenchmarkDecodeBase58_B_op":0,"BenchmarkDecodeBase58_allocs_op":0,"BenchmarkEncodeBase58_ns_op":82.46,"BenchmarkEncodeBase58_B_op":24,"BenchmarkEncodeBase58_allocs_op":1,"BenchmarkEncodeDecodeBase58_ns_op":109.3,"BenchmarkEncodeDecodeBase58_B_op":24,"BenchmarkEncodeDecodeBase58_allocs_op":1,"BenchmarkFromTime_ns_op":64.98,"BenchmarkFromTime_B_op":0,"BenchmarkFromTime_allocs_op":0,"BenchmarkGenerateUUID_ns_op":571.5,"BenchmarkGenerateUUID_B_op":24,"BenchmarkGenerateUUID_allocs_op":1,"BenchmarkMainGenerate_ns_op":578.6,"BenchmarkMainGenerate_B_op":24,"BenchmarkMainGenerate_allocs_op":1,"BenchmarkMainHelp_ns_op":361.4,"BenchmarkMainHelp_B_op":0,"BenchmarkMainHelp_allocs_op":0,"BenchmarkMainParse_ns_op":503.9,"BenchmarkMainParse_B_op":0,"BenchmarkMainParse_allocs_op":0,"BenchmarkNewString_ns_op":192.9,"BenchmarkNewString_B_op":24,"BenchmarkNewString_allocs_op":1,"BenchmarkParseUUID_ns_op":508.9,"BenchmarkParseUUID_B_op":0,"BenchmarkParseUUID_allocs_op":0,"BenchmarkUUID7_ns_op":98.39,"BenchmarkUUID7_B_op":0,"BenchmarkUUID7_allocs_op":0},"status":"keep","description":"Use two uint64 limbs with bits.Mul64 for Base58 decode","timestamp":1782060117439,"segment":0,"confidence":5.585017136043823,"asi":{"hypothesis":"For decoding, modulo-2^128 arithmetic can be represented as two uint64 limbs; multiplying the low limb by 58 with bits.Mul64 and carrying into the high limb should require much less work than four uint32 limb updates while preserving the low 128 decoded bits.","learned":"Very large decode win: DecodeBase58 fell from ~56ns to ~21ns, improving encode-decode and parse paths. This is safe for fixed 22-digit hqid7 inputs because the original decoder truncated to the low 16 bytes."}}
{"run":27,"commit":"5c27e20","metric":0,"metrics":{"BenchmarkDecodeBase58_ns_op":0,"BenchmarkDecodeBase58_B_op":0,"BenchmarkDecodeBase58_allocs_op":0,"BenchmarkEncodeBase58_ns_op":0,"BenchmarkEncodeBase58_B_op":0,"BenchmarkEncodeBase58_allocs_op":0,"BenchmarkEncodeDecodeBase58_ns_op":0,"BenchmarkEncodeDecodeBase58_B_op":0,"BenchmarkEncodeDecodeBase58_allocs_op":0,"BenchmarkFromTime_ns_op":0,"BenchmarkFromTime_B_op":0,"BenchmarkFromTime_allocs_op":0,"BenchmarkGenerateUUID_ns_op":0,"BenchmarkGenerateUUID_B_op":0,"BenchmarkGenerateUUID_allocs_op":0,"BenchmarkMainGenerate_ns_op":0,"BenchmarkMainGenerate_B_op":0,"BenchmarkMainGenerate_allocs_op":0,"BenchmarkMainHelp_ns_op":0,"BenchmarkMainHelp_B_op":0,"BenchmarkMainHelp_allocs_op":0,"BenchmarkMainParse_ns_op":0,"BenchmarkMainParse_B_op":0,"BenchmarkMainParse_allocs_op":0,"BenchmarkNewString_ns_op":0,"BenchmarkNewString_B_op":0,"BenchmarkNewString_allocs_op":0,"BenchmarkParseUUID_ns_op":0,"BenchmarkParseUUID_B_op":0,"BenchmarkParseUUID_allocs_op":0,"BenchmarkUUID7_ns_op":0,"BenchmarkUUID7_B_op":0,"BenchmarkUUID7_allocs_op":0},"status":"crash","description":"Attempt branchless Add64 carry in Base58 decoder but introduced short-declaration shadowing","timestamp":1782060177958,"segment":0,"confidence":5.585017136043823,"asi":{"hypothesis":"Replacing the overflow branch after loProd+digit with bits.Add64 might make decode branchless and faster.","rollback_reason":"The initial implementation used `lo, carry :=` inside loop bodies, which shadowed the outer lo and failed to compile as the inner lo was unused.","next_action_hint":"Retry with a carry variable declared outside the loops and `lo, carry = bits.Add64(...)` assignments, then benchmark."}}
{"run":28,"commit":"5c27e20","metric":182.8261404024895,"metrics":{"BenchmarkDecodeBase58_ns_op":21.35,"BenchmarkDecodeBase58_B_op":0,"BenchmarkDecodeBase58_allocs_op":0,"BenchmarkEncodeBase58_ns_op":81.85,"BenchmarkEncodeBase58_B_op":24,"BenchmarkEncodeBase58_allocs_op":1,"BenchmarkEncodeDecodeBase58_ns_op":108.4,"BenchmarkEncodeDecodeBase58_B_op":24,"BenchmarkEncodeDecodeBase58_allocs_op":1,"BenchmarkFromTime_ns_op":65.04,"BenchmarkFromTime_B_op":0,"BenchmarkFromTime_allocs_op":0,"BenchmarkGenerateUUID_ns_op":570.4,"BenchmarkGenerateUUID_B_op":24,"BenchmarkGenerateUUID_allocs_op":1,"BenchmarkMainGenerate_ns_op":574.2,"BenchmarkMainGenerate_B_op":24,"BenchmarkMainGenerate_allocs_op":1,"BenchmarkMainHelp_ns_op":364.3,"BenchmarkMainHelp_B_op":0,"BenchmarkMainHelp_allocs_op":0,"BenchmarkMainParse_ns_op":510.7,"BenchmarkMainParse_B_op":0,"BenchmarkMainParse_allocs_op":0,"BenchmarkNewString_ns_op":203.6,"BenchmarkNewString_B_op":24,"BenchmarkNewString_allocs_op":1,"BenchmarkParseUUID_ns_op":510.7,"BenchmarkParseUUID_B_op":0,"BenchmarkParseUUID_allocs_op":0,"BenchmarkUUID7_ns_op":97.72,"BenchmarkUUID7_B_op":0,"BenchmarkUUID7_allocs_op":0},"status":"discard","description":"Use bits.Add64 for branchless Base58 decode carry","timestamp":1782060243282,"segment":0,"confidence":5.754724011765219,"asi":{"hypothesis":"bits.Add64 can replace the rare overflow comparison after adding the Base58 digit to the low limb, making the decode update more branchless.","rollback_reason":"Correctness checks passed, but primary geomean was slightly worse than current best and DecodeBase58 was marginally slower. The compiler's compare/conditional increment is already optimal here or the Add64 intrinsic adds overhead.","next_action_hint":"Keep the simple `lo = loProd + digit; if lo < loProd { loCarry++ }` decode carry handling."}}
{"run":29,"commit":"5c27e20","metric":182.84314990180016,"metrics":{"BenchmarkDecodeBase58_ns_op":21.04,"BenchmarkDecodeBase58_B_op":0,"BenchmarkDecodeBase58_allocs_op":0,"BenchmarkEncodeBase58_ns_op":82.39,"BenchmarkEncodeBase58_B_op":24,"BenchmarkEncodeBase58_allocs_op":1,"BenchmarkEncodeDecodeBase58_ns_op":109.2,"BenchmarkEncodeDecodeBase58_B_op":24,"BenchmarkEncodeDecodeBase58_allocs_op":1,"BenchmarkFromTime_ns_op":65.2,"BenchmarkFromTime_B_op":0,"BenchmarkFromTime_allocs_op":0,"BenchmarkGenerateUUID_ns_op":575.2,"BenchmarkGenerateUUID_B_op":24,"BenchmarkGenerateUUID_allocs_op":1,"BenchmarkMainGenerate_ns_op":575.1,"BenchmarkMainGenerate_B_op":24,"BenchmarkMainGenerate_allocs_op":1,"BenchmarkMainHelp_ns_op":367.4,"BenchmarkMainHelp_B_op":0,"BenchmarkMainHelp_allocs_op":0,"BenchmarkMainParse_ns_op":511.6,"BenchmarkMainParse_B_op":0,"BenchmarkMainParse_allocs_op":0,"BenchmarkNewString_ns_op":197.8,"BenchmarkNewString_B_op":24,"BenchmarkNewString_allocs_op":1,"BenchmarkParseUUID_ns_op":513.9,"BenchmarkParseUUID_B_op":0,"BenchmarkParseUUID_allocs_op":0,"BenchmarkUUID7_ns_op":97.89,"BenchmarkUUID7_B_op":0,"BenchmarkUUID7_allocs_op":0},"status":"discard","description":"Inline MustUUID7 logic in NewString","timestamp":1782060289154,"segment":0,"confidence":5.6382236108636,"asi":{"hypothesis":"Inlining MustUUID7's error handling directly in NewString might avoid an extra function call on the hot NewString path.","rollback_reason":"The change passed correctness but primary geomean worsened slightly and NewString did not improve, indicating the compiler already inlines or optimizes the existing MustUUID7 call adequately.","next_action_hint":"Keep NewString delegating to EncodeBase58(MustUUID7()). Focus on larger costs such as CLI writes/time formatting or Base58 encode."}}
{"run":30,"commit":"5c27e20","metric":182.37409006015338,"metrics":{"BenchmarkDecodeBase58_ns_op":20.98,"BenchmarkDecodeBase58_B_op":0,"BenchmarkDecodeBase58_allocs_op":0,"BenchmarkEncodeBase58_ns_op":81.94,"BenchmarkEncodeBase58_B_op":24,"BenchmarkEncodeBase58_allocs_op":1,"BenchmarkEncodeDecodeBase58_ns_op":108.5,"BenchmarkEncodeDecodeBase58_B_op":24,"BenchmarkEncodeDecodeBase58_allocs_op":1,"BenchmarkFromTime_ns_op":66.03,"BenchmarkFromTime_B_op":0,"BenchmarkFromTime_allocs_op":0,"BenchmarkGenerateUUID_ns_op":577.5,"BenchmarkGenerateUUID_B_op":24,"BenchmarkGenerateUUID_allocs_op":1,"BenchmarkMainGenerate_ns_op":579.4,"BenchmarkMainGenerate_B_op":24,"BenchmarkMainGenerate_allocs_op":1,"BenchmarkMainHelp_ns_op":367,"BenchmarkMainHelp_B_op":0,"BenchmarkMainHelp_allocs_op":0,"BenchmarkMainParse_ns_op":511.3,"BenchmarkMainParse_B_op":0,"BenchmarkMainParse_allocs_op":0,"BenchmarkNewString_ns_op":190.9,"BenchmarkNewString_B_op":24,"BenchmarkNewString_allocs_op":1,"BenchmarkParseUUID_ns_op":512.7,"BenchmarkParseUUID_B_op":0,"BenchmarkParseUUID_allocs_op":0,"BenchmarkUUID7_ns_op":98.08,"BenchmarkUUID7_B_op":0,"BenchmarkUUID7_allocs_op":0},"status":"discard","description":"Factor UUID generation through unix-nanoseconds helper","timestamp":1782060333884,"segment":0,"confidence":5.526346553393018,"asi":{"hypothesis":"Having UUID7 call a helper with time.Now().UnixNano directly may avoid passing a full time.Time through FromTime while preserving FromTime behavior via the same helper.","rollback_reason":"Correctness passed, but primary metric was slightly worse than current best; UUID7 did not improve and FromTime regressed. The extra helper/inlining tradeoff is not beneficial.","next_action_hint":"Keep UUID7 delegating to FromTime(time.Now()). Timestamp helper factoring is not worth pursuing without a clearer compiler benefit."}}
{"run":31,"commit":"f02d177","metric":181.3972989775174,"metrics":{"BenchmarkDecodeBase58_ns_op":21.05,"BenchmarkDecodeBase58_B_op":0,"BenchmarkDecodeBase58_allocs_op":0,"BenchmarkEncodeBase58_ns_op":81.77,"BenchmarkEncodeBase58_B_op":24,"BenchmarkEncodeBase58_allocs_op":1,"BenchmarkEncodeDecodeBase58_ns_op":108.5,"BenchmarkEncodeDecodeBase58_B_op":24,"BenchmarkEncodeDecodeBase58_allocs_op":1,"BenchmarkFromTime_ns_op":65.15,"BenchmarkFromTime_B_op":0,"BenchmarkFromTime_allocs_op":0,"BenchmarkGenerateUUID_ns_op":571.4,"BenchmarkGenerateUUID_B_op":24,"BenchmarkGenerateUUID_allocs_op":1,"BenchmarkMainGenerate_ns_op":577.9,"BenchmarkMainGenerate_B_op":24,"BenchmarkMainGenerate_allocs_op":1,"BenchmarkMainHelp_ns_op":367.2,"BenchmarkMainHelp_B_op":0,"BenchmarkMainHelp_allocs_op":0,"BenchmarkMainParse_ns_op":500.9,"BenchmarkMainParse_B_op":0,"BenchmarkMainParse_allocs_op":0,"BenchmarkNewString_ns_op":191.6,"BenchmarkNewString_B_op":24,"BenchmarkNewString_allocs_op":1,"BenchmarkParseUUID_ns_op":502.7,"BenchmarkParseUUID_B_op":0,"BenchmarkParseUUID_allocs_op":0,"BenchmarkUUID7_ns_op":98.31,"BenchmarkUUID7_B_op":0,"BenchmarkUUID7_allocs_op":0},"status":"keep","description":"Reduce CLI parse stack output buffer size","timestamp":1782060378984,"segment":0,"confidence":5.698174238097155,"asi":{"hypothesis":"The parse output buffer is stack-allocated and zeroed; reducing it from 512 to 320 bytes should still cover normal parse output while lowering stack zeroing/copy overhead, with append still preserving correctness if an unusual long zone name requires growth.","learned":"Small parse-path win with zero allocations retained for the benchmark output (about 299 bytes in the local environment). This is a general buffer sizing improvement rather than output-specific logic."}}
{"run":32,"commit":"01a9080","metric":168.136459630738,"metrics":{"BenchmarkDecodeBase58_ns_op":21.03,"BenchmarkDecodeBase58_B_op":0,"BenchmarkDecodeBase58_allocs_op":0,"BenchmarkEncodeBase58_ns_op":57.43,"BenchmarkEncodeBase58_B_op":24,"BenchmarkEncodeBase58_allocs_op":1,"BenchmarkEncodeDecodeBase58_ns_op":84.8,"BenchmarkEncodeDecodeBase58_B_op":24,"BenchmarkEncodeDecodeBase58_allocs_op":1,"BenchmarkFromTime_ns_op":64.65,"BenchmarkFromTime_B_op":0,"BenchmarkFromTime_allocs_op":0,"BenchmarkGenerateUUID_ns_op":547.7,"BenchmarkGenerateUUID_B_op":24,"BenchmarkGenerateUUID_allocs_op":1,"BenchmarkMainGenerate_ns_op":551.4,"BenchmarkMainGenerate_B_op":24,"BenchmarkMainGenerate_allocs_op":1,"BenchmarkMainHelp_ns_op":369.6,"BenchmarkMainHelp_B_op":0,"BenchmarkMainHelp_allocs_op":0,"BenchmarkMainParse_ns_op":503.8,"BenchmarkMainParse_B_op":0,"BenchmarkMainParse_allocs_op":0,"BenchmarkNewString_ns_op":167.8,"BenchmarkNewString_B_op":24,"BenchmarkNewString_allocs_op":1,"BenchmarkParseUUID_ns_op":501.6,"BenchmarkParseUUID_B_op":0,"BenchmarkParseUUID_allocs_op":0,"BenchmarkUUID7_ns_op":96.87,"BenchmarkUUID7_B_op":0,"BenchmarkUUID7_allocs_op":0},"status":"keep","description":"Encode Base58 two digits at a time with base 58 squared","timestamp":1782060437235,"segment":0,"confidence":5.9281208409057315,"asi":{"hypothesis":"Since hqid7's fixed Base58 width is 22 characters, the encoder can divide the 128-bit value by 58^2 and emit two digits per iteration, halving the number of limb-division passes while preserving padded output.","learned":"Large encode win: EncodeBase58 fell from ~82ns to ~57ns, NewString and generate paths improved, and exhaustive encode/order checks passed. Pairwise base-58 chunks are a clean general fixed-width optimization."}}
{"run":33,"commit":"dd57f21","metric":158.1958321465009,"metrics":{"BenchmarkDecodeBase58_ns_op":20.96,"BenchmarkDecodeBase58_B_op":0,"BenchmarkDecodeBase58_allocs_op":0,"BenchmarkEncodeBase58_ns_op":42.65,"BenchmarkEncodeBase58_B_op":24,"BenchmarkEncodeBase58_allocs_op":1,"BenchmarkEncodeDecodeBase58_ns_op":68.59,"BenchmarkEncodeDecodeBase58_B_op":24,"BenchmarkEncodeDecodeBase58_allocs_op":1,"BenchmarkFromTime_ns_op":64.67,"BenchmarkFromTime_B_op":0,"BenchmarkFromTime_allocs_op":0,"BenchmarkGenerateUUID_ns_op":532.5,"BenchmarkGenerateUUID_B_op":24,"BenchmarkGenerateUUID_allocs_op":1,"BenchmarkMainGenerate_ns_op":534.6,"BenchmarkMainGenerate_B_op":24,"BenchmarkMainGenerate_allocs_op":1,"BenchmarkMainHelp_ns_op":366.2,"BenchmarkMainHelp_B_op":0,"BenchmarkMainHelp_allocs_op":0,"BenchmarkMainParse_ns_op":506.6,"BenchmarkMainParse_B_op":0,"BenchmarkMainParse_allocs_op":0,"BenchmarkNewString_ns_op":152.2,"BenchmarkNewString_B_op":24,"BenchmarkNewString_allocs_op":1,"BenchmarkParseUUID_ns_op":501.1,"BenchmarkParseUUID_B_op":0,"BenchmarkParseUUID_allocs_op":0,"BenchmarkUUID7_ns_op":97.23,"BenchmarkUUID7_B_op":0,"BenchmarkUUID7_allocs_op":0},"status":"keep","description":"Encode Base58 three digits at a time with base 58 cubed","timestamp":1782060491300,"segment":0,"confidence":5.852953856492834,"asi":{"hypothesis":"The fixed 22-character width can also be filled from the right in base 58^3 chunks (seven full 3-digit groups plus one leading digit), further reducing 128-bit division passes versus 58^2.","learned":"Another large encode win: EncodeBase58 dropped from ~57ns to ~43ns and NewString to ~152ns. The top partial group is safe because 22 Base58 digits leave a one-character leading group; exhaustive tests passed."}}
