{"run":34,"commit":"9bc56f3","metric":156.32365839123676,"metrics":{"BenchmarkDecodeBase58_ns_op":21.05,"BenchmarkDecodeBase58_B_op":0,"BenchmarkDecodeBase58_allocs_op":0,"BenchmarkEncodeBase58_ns_op":41.27,"BenchmarkEncodeBase58_B_op":24,"BenchmarkEncodeBase58_allocs_op":1,"BenchmarkEncodeDecodeBase58_ns_op":66.43,"BenchmarkEncodeDecodeBase58_B_op":24,"BenchmarkEncodeDecodeBase58_allocs_op":1,"BenchmarkFromTime_ns_op":66.41,"BenchmarkFromTime_B_op":0,"BenchmarkFromTime_allocs_op":0,"BenchmarkGenerateUUID_ns_op":521,"BenchmarkGenerateUUID_B_op":24,"BenchmarkGenerateUUID_allocs_op":1,"BenchmarkMainGenerate_ns_op":527,"BenchmarkMainGenerate_B_op":24,"BenchmarkMainGenerate_allocs_op":1,"BenchmarkMainHelp_ns_op":360.1,"BenchmarkMainHelp_B_op":0,"BenchmarkMainHelp_allocs_op":0,"BenchmarkMainParse_ns_op":496.9,"BenchmarkMainParse_B_op":0,"BenchmarkMainParse_allocs_op":0,"BenchmarkNewString_ns_op":149.6,"BenchmarkNewString_B_op":24,"BenchmarkNewString_allocs_op":1,"BenchmarkParseUUID_ns_op":493.1,"BenchmarkParseUUID_B_op":0,"BenchmarkParseUUID_allocs_op":0,"BenchmarkUUID7_ns_op":98.08,"BenchmarkUUID7_B_op":0,"BenchmarkUUID7_allocs_op":0},"status":"keep","description":"Encode Base58 four digits at a time with base 58^4 chunks","timestamp":1782060544756,"segment":0,"confidence":5.870960060525339,"asi":{"hypothesis":"Using base 58^4 chunks reduces the fixed-width encoder to six 128-bit division passes (five full 4-character groups plus a two-character leading group), which may beat the 58^3 encoder despite a larger divisor.","learned":"Base58^4 improved EncodeBase58 further (~43ns to ~41ns) and helped generate/NewString. The gain is smaller than prior chunking but correctness checks passed, so 4-digit chunks are the current best encoding strategy."}}
{"run":35,"commit":"9bc56f3","metric":156.7782910434946,"metrics":{"BenchmarkDecodeBase58_ns_op":21.1,"BenchmarkDecodeBase58_B_op":0,"BenchmarkDecodeBase58_allocs_op":0,"BenchmarkEncodeBase58_ns_op":42.32,"BenchmarkEncodeBase58_B_op":24,"BenchmarkEncodeBase58_allocs_op":1,"BenchmarkEncodeDecodeBase58_ns_op":66.48,"BenchmarkEncodeDecodeBase58_B_op":24,"BenchmarkEncodeDecodeBase58_allocs_op":1,"BenchmarkFromTime_ns_op":65.98,"BenchmarkFromTime_B_op":0,"BenchmarkFromTime_allocs_op":0,"BenchmarkGenerateUUID_ns_op":526.3,"BenchmarkGenerateUUID_B_op":24,"BenchmarkGenerateUUID_allocs_op":1,"BenchmarkMainGenerate_ns_op":527.8,"BenchmarkMainGenerate_B_op":24,"BenchmarkMainGenerate_allocs_op":1,"BenchmarkMainHelp_ns_op":361.3,"BenchmarkMainHelp_B_op":0,"BenchmarkMainHelp_allocs_op":0,"BenchmarkMainParse_ns_op":496.3,"BenchmarkMainParse_B_op":0,"BenchmarkMainParse_allocs_op":0,"BenchmarkNewString_ns_op":150.1,"BenchmarkNewString_B_op":24,"BenchmarkNewString_allocs_op":1,"BenchmarkParseUUID_ns_op":494.6,"BenchmarkParseUUID_B_op":0,"BenchmarkParseUUID_allocs_op":0,"BenchmarkUUID7_ns_op":97.11,"BenchmarkUUID7_B_op":0,"BenchmarkUUID7_allocs_op":0},"status":"discard","description":"Try Base58 encoder with 58^5 chunks","timestamp":1782060597232,"segment":0,"confidence":5.713489743408607,"asi":{"hypothesis":"Base 58^5 chunks reduce the encoder to five division passes, which might overcome the larger divisor and extra digit extraction for each chunk.","rollback_reason":"Correctness passed, but primary geomean and EncodeBase58 were slightly worse than the 58^4 encoder. The larger divisor and 5-digit extraction outweigh the reduced pass count on this platform.","next_action_hint":"Keep 58^4 chunks as the best observed encoder chunk size; avoid larger chunk sizes unless using a different division strategy."}}
{"run":36,"commit":"88ff7c3","metric":153.63007734016531,"metrics":{"BenchmarkDecodeBase58_ns_op":21.03,"BenchmarkDecodeBase58_B_op":0,"BenchmarkDecodeBase58_allocs_op":0,"BenchmarkEncodeBase58_ns_op":36.99,"BenchmarkEncodeBase58_B_op":24,"BenchmarkEncodeBase58_allocs_op":1,"BenchmarkEncodeDecodeBase58_ns_op":63.88,"BenchmarkEncodeDecodeBase58_B_op":24,"BenchmarkEncodeDecodeBase58_allocs_op":1,"BenchmarkFromTime_ns_op":65.5,"BenchmarkFromTime_B_op":0,"BenchmarkFromTime_allocs_op":0,"BenchmarkGenerateUUID_ns_op":522.2,"BenchmarkGenerateUUID_B_op":24,"BenchmarkGenerateUUID_allocs_op":1,"BenchmarkMainGenerate_ns_op":535.8,"BenchmarkMainGenerate_B_op":24,"BenchmarkMainGenerate_allocs_op":1,"BenchmarkMainHelp_ns_op":356.4,"BenchmarkMainHelp_B_op":0,"BenchmarkMainHelp_allocs_op":0,"BenchmarkMainParse_ns_op":497.2,"BenchmarkMainParse_B_op":0,"BenchmarkMainParse_allocs_op":0,"BenchmarkNewString_ns_op":145.9,"BenchmarkNewString_B_op":24,"BenchmarkNewString_allocs_op":1,"BenchmarkParseUUID_ns_op":493.3,"BenchmarkParseUUID_B_op":0,"BenchmarkParseUUID_allocs_op":0,"BenchmarkUUID7_ns_op":96.88,"BenchmarkUUID7_B_op":0,"BenchmarkUUID7_allocs_op":0},"status":"keep","description":"Use Base58 pair lookup table for 58^4 chunk digit extraction","timestamp":1782060652170,"segment":0,"confidence":5.171689659859665,"asi":{"hypothesis":"For 58^4 chunks, rem can be split into two base-58 pairs; a small 3364-entry pair table should replace several per-chunk /58 and %58 operations with two table lookups while preserving all outputs.","learned":"EncodeBase58 improved from ~41ns to ~37ns with a modest 6.5KB lookup table initialized at package startup. This is a general chunk-digit extraction optimization."}}
{"run":37,"commit":"2a8cf2e","metric":153.49307272287018,"metrics":{"BenchmarkDecodeBase58_ns_op":20.83,"BenchmarkDecodeBase58_B_op":0,"BenchmarkDecodeBase58_allocs_op":0,"BenchmarkEncodeBase58_ns_op":37.33,"BenchmarkEncodeBase58_B_op":24,"BenchmarkEncodeBase58_allocs_op":1,"BenchmarkEncodeDecodeBase58_ns_op":64.06,"BenchmarkEncodeDecodeBase58_B_op":24,"BenchmarkEncodeDecodeBase58_allocs_op":1,"BenchmarkFromTime_ns_op":63.65,"BenchmarkFromTime_B_op":0,"BenchmarkFromTime_allocs_op":0,"BenchmarkGenerateUUID_ns_op":528.2,"BenchmarkGenerateUUID_B_op":24,"BenchmarkGenerateUUID_allocs_op":1,"BenchmarkMainGenerate_ns_op":525.3,"BenchmarkMainGenerate_B_op":24,"BenchmarkMainGenerate_allocs_op":1,"BenchmarkMainHelp_ns_op":360.3,"BenchmarkMainHelp_B_op":0,"BenchmarkMainHelp_allocs_op":0,"BenchmarkMainParse_ns_op":498.8,"BenchmarkMainParse_B_op":0,"BenchmarkMainParse_allocs_op":0,"BenchmarkNewString_ns_op":147.2,"BenchmarkNewString_B_op":24,"BenchmarkNewString_allocs_op":1,"BenchmarkParseUUID_ns_op":497.8,"BenchmarkParseUUID_B_op":0,"BenchmarkParseUUID_allocs_op":0,"BenchmarkUUID7_ns_op":96.18,"BenchmarkUUID7_B_op":0,"BenchmarkUUID7_allocs_op":0},"status":"keep","description":"Try 58^5 encoding with pair-table digit extraction","timestamp":1782060710333,"segment":0,"confidence":6.43312781934044,"asi":{"hypothesis":"The previous 58^5 encoder lost to 58^4 partly due digit extraction; reusing the 58^2 pair table for the low/middle digit pairs may make five-digit chunks competitive.","learned":"Primary geomean improved very slightly, although EncodeBase58 itself was a bit slower than the 58^4 pair-table sample. This keep is likely noise-sensitive; consider rerunning or reverting to 58^4 if subsequent runs show no durable primary gain."}}
{"run":38,"commit":"004500e","metric":153.05139448980287,"metrics":{"BenchmarkDecodeBase58_ns_op":21.16,"BenchmarkDecodeBase58_B_op":0,"BenchmarkDecodeBase58_allocs_op":0,"BenchmarkEncodeBase58_ns_op":38.33,"BenchmarkEncodeBase58_B_op":24,"BenchmarkEncodeBase58_allocs_op":1,"BenchmarkEncodeDecodeBase58_ns_op":62.57,"BenchmarkEncodeDecodeBase58_B_op":24,"BenchmarkEncodeDecodeBase58_allocs_op":1,"BenchmarkFromTime_ns_op":64.87,"BenchmarkFromTime_B_op":0,"BenchmarkFromTime_allocs_op":0,"BenchmarkGenerateUUID_ns_op":518.6,"BenchmarkGenerateUUID_B_op":24,"BenchmarkGenerateUUID_allocs_op":1,"BenchmarkMainGenerate_ns_op":517.6,"BenchmarkMainGenerate_B_op":24,"BenchmarkMainGenerate_allocs_op":1,"BenchmarkMainHelp_ns_op":361.9,"BenchmarkMainHelp_B_op":0,"BenchmarkMainHelp_allocs_op":0,"BenchmarkMainParse_ns_op":490.8,"BenchmarkMainParse_B_op":0,"BenchmarkMainParse_allocs_op":0,"BenchmarkNewString_ns_op":144.5,"BenchmarkNewString_B_op":24,"BenchmarkNewString_allocs_op":1,"BenchmarkParseUUID_ns_op":492.8,"BenchmarkParseUUID_B_op":0,"BenchmarkParseUUID_allocs_op":0,"BenchmarkUUID7_ns_op":96.58,"BenchmarkUUID7_B_op":0,"BenchmarkUUID7_allocs_op":0},"status":"keep","description":"Return to 58^4 pair-table encoder after comparing against 58^5","timestamp":1782060759594,"segment":0,"confidence":7.244320068354348,"asi":{"hypothesis":"The 58^5 pair-table result looked noise-sensitive and had slower EncodeBase58; restoring the simpler 58^4 pair-table encoder may be the more robust choice and could improve primary under a fresh sample.","learned":"Fresh sample with 58^4 pair-table produced the best primary so far (~153.05). Encode-specific numbers remain noisy, but 58^4 is simpler and previously had the best direct EncodeBase58 sample, so it is preferable to 58^5."}}
{"run":39,"commit":"81559d6","metric":144.43246312966838,"metrics":{"BenchmarkDecodeBase58_ns_op":13.76,"BenchmarkDecodeBase58_B_op":0,"BenchmarkDecodeBase58_allocs_op":0,"BenchmarkEncodeBase58_ns_op":38.01,"BenchmarkEncodeBase58_B_op":24,"BenchmarkEncodeBase58_allocs_op":1,"BenchmarkEncodeDecodeBase58_ns_op":55.84,"BenchmarkEncodeDecodeBase58_B_op":24,"BenchmarkEncodeDecodeBase58_allocs_op":1,"BenchmarkFromTime_ns_op":64.23,"BenchmarkFromTime_B_op":0,"BenchmarkFromTime_allocs_op":0,"BenchmarkGenerateUUID_ns_op":516.7,"BenchmarkGenerateUUID_B_op":24,"BenchmarkGenerateUUID_allocs_op":1,"BenchmarkMainGenerate_ns_op":515.2,"BenchmarkMainGenerate_B_op":24,"BenchmarkMainGenerate_allocs_op":1,"BenchmarkMainHelp_ns_op":356.5,"BenchmarkMainHelp_B_op":0,"BenchmarkMainHelp_allocs_op":0,"BenchmarkMainParse_ns_op":481.1,"BenchmarkMainParse_B_op":0,"BenchmarkMainParse_allocs_op":0,"BenchmarkNewString_ns_op":144.2,"BenchmarkNewString_B_op":24,"BenchmarkNewString_allocs_op":1,"BenchmarkParseUUID_ns_op":479.2,"BenchmarkParseUUID_B_op":0,"BenchmarkParseUUID_allocs_op":0,"BenchmarkUUID7_ns_op":96.41,"BenchmarkUUID7_B_op":0,"BenchmarkUUID7_allocs_op":0},"status":"keep","description":"Decode Base58 two digits at a time with base 58^2","timestamp":1782060834134,"segment":0,"confidence":7.250202473130593,"asi":{"hypothesis":"The fixed 22-digit hqid7 payload can be decoded as eleven base-58^2 pairs, halving decode multiply/carry updates while preserving left-to-right invalid character validation across the separator.","learned":"DecodeBase58 improved from ~21ns to ~14ns and parse/encode-decode paths improved. Pair decoding is the decode analogue of chunked encoding and remains general for all length-valid hqid7 strings."}}
{"run":40,"commit":"81559d6","metric":144.83713874352975,"metrics":{"BenchmarkDecodeBase58_ns_op":12.49,"BenchmarkDecodeBase58_B_op":0,"BenchmarkDecodeBase58_allocs_op":0,"BenchmarkEncodeBase58_ns_op":37.9,"BenchmarkEncodeBase58_B_op":24,"BenchmarkEncodeBase58_allocs_op":1,"BenchmarkEncodeDecodeBase58_ns_op":54.42,"BenchmarkEncodeDecodeBase58_B_op":24,"BenchmarkEncodeDecodeBase58_allocs_op":1,"BenchmarkFromTime_ns_op":64.15,"BenchmarkFromTime_B_op":0,"BenchmarkFromTime_allocs_op":0,"BenchmarkGenerateUUID_ns_op":528.7,"BenchmarkGenerateUUID_B_op":24,"BenchmarkGenerateUUID_allocs_op":1,"BenchmarkMainGenerate_ns_op":522.2,"BenchmarkMainGenerate_B_op":24,"BenchmarkMainGenerate_allocs_op":1,"BenchmarkMainHelp_ns_op":359.9,"BenchmarkMainHelp_B_op":0,"BenchmarkMainHelp_allocs_op":0,"BenchmarkMainParse_ns_op":490.5,"BenchmarkMainParse_B_op":0,"BenchmarkMainParse_allocs_op":0,"BenchmarkNewString_ns_op":152.9,"BenchmarkNewString_B_op":24,"BenchmarkNewString_allocs_op":1,"BenchmarkParseUUID_ns_op":488.9,"BenchmarkParseUUID_B_op":0,"BenchmarkParseUUID_allocs_op":0,"BenchmarkUUID7_ns_op":97.73,"BenchmarkUUID7_B_op":0,"BenchmarkUUID7_allocs_op":0},"status":"discard","description":"Use 16-bit Base58 pair lookup table in decoder","timestamp":1782062124348,"segment":0,"confidence":7.158055742072512,"asi":{"hypothesis":"A 65536-entry lookup table for valid Base58 digit pairs can replace two byte lookups plus pair arithmetic in the paired decoder while still preserving left-to-right invalid digit errors via a cold fallback.","rollback_reason":"Correctness checks passed and DecodeBase58 improved (~13.8ns to ~12.5ns), but primary geomean regressed versus the current best due noise/regressions in NewString/generate paths. The 128KB table is also less attractive for a small decode-only gain.","next_action_hint":"Keep the simpler two-character decode arithmetic for now. Revisit only if repeated measurements show decode dominates or if a smaller pair table can retain the gain without hurting overall geomean."}}
{"run":41,"commit":"81559d6","metric":146.09707559970397,"metrics":{"BenchmarkDecodeBase58_ns_op":13.64,"BenchmarkDecodeBase58_B_op":0,"BenchmarkDecodeBase58_allocs_op":0,"BenchmarkEncodeBase58_ns_op":41.66,"BenchmarkEncodeBase58_B_op":24,"BenchmarkEncodeBase58_allocs_op":1,"BenchmarkEncodeDecodeBase58_ns_op":54.51,"BenchmarkEncodeDecodeBase58_B_op":0,"BenchmarkEncodeDecodeBase58_allocs_op":0,"BenchmarkFromTime_ns_op":65.95,"BenchmarkFromTime_B_op":0,"BenchmarkFromTime_allocs_op":0,"BenchmarkGenerateUUID_ns_op":509.5,"BenchmarkGenerateUUID_B_op":0,"BenchmarkGenerateUUID_allocs_op":0,"BenchmarkMainGenerate_ns_op":510.3,"BenchmarkMainGenerate_B_op":0,"BenchmarkMainGenerate_allocs_op":0,"BenchmarkMainHelp_ns_op":359.1,"BenchmarkMainHelp_B_op":0,"BenchmarkMainHelp_allocs_op":0,"BenchmarkMainParse_ns_op":484.3,"BenchmarkMainParse_B_op":0,"BenchmarkMainParse_allocs_op":0,"BenchmarkNewString_ns_op":148.5,"BenchmarkNewString_B_op":24,"BenchmarkNewString_allocs_op":1,"BenchmarkParseUUID_ns_op":484.1,"BenchmarkParseUUID_B_op":0,"BenchmarkParseUUID_allocs_op":0,"BenchmarkUUID7_ns_op":97.47,"BenchmarkUUID7_B_op":0,"BenchmarkUUID7_allocs_op":0},"status":"discard","description":"Add AppendBase58 helper and use stack buffer for CLI generate output","timestamp":1782062219477,"segment":0,"confidence":7.355829903832212,"asi":{"hypothesis":"Expose an append-style Base58 formatter so the CLI generate path can write a stack buffer with newline, avoiding the encoded string allocation and string concatenation while preserving the existing EncodeBase58 API.","rollback_reason":"Correctness checks passed and CLI generate allocations fell to zero, but primary geomean regressed versus the current best. EncodeBase58 slowed due the append helper indirection/slice appends, and primary metric did not reward the allocation win enough.","next_action_hint":"Do not keep the exported append helper in this form. If revisiting zero-allocation CLI generate, duplicate a private stack encoder in cmd or refactor around a non-slowing internal helper, then verify EncodeBase58 remains fast."}}
{"run":42,"commit":"81559d6","metric":146.1337304964087,"metrics":{"BenchmarkDecodeBase58_ns_op":13.62,"BenchmarkDecodeBase58_B_op":0,"BenchmarkDecodeBase58_allocs_op":0,"BenchmarkEncodeBase58_ns_op":37.7,"BenchmarkEncodeBase58_B_op":24,"BenchmarkEncodeBase58_allocs_op":1,"BenchmarkEncodeDecodeBase58_ns_op":58.08,"BenchmarkEncodeDecodeBase58_B_op":24,"BenchmarkEncodeDecodeBase58_allocs_op":1,"BenchmarkFromTime_ns_op":64.76,"BenchmarkFromTime_B_op":0,"BenchmarkFromTime_allocs_op":0,"BenchmarkGenerateUUID_ns_op":523.4,"BenchmarkGenerateUUID_B_op":24,"BenchmarkGenerateUUID_allocs_op":1,"BenchmarkMainGenerate_ns_op":525.2,"BenchmarkMainGenerate_B_op":24,"BenchmarkMainGenerate_allocs_op":1,"BenchmarkMainHelp_ns_op":359.8,"BenchmarkMainHelp_B_op":0,"BenchmarkMainHelp_allocs_op":0,"BenchmarkMainParse_ns_op":485.2,"BenchmarkMainParse_B_op":0,"BenchmarkMainParse_allocs_op":0,"BenchmarkNewString_ns_op":146.8,"BenchmarkNewString_B_op":24,"BenchmarkNewString_allocs_op":1,"BenchmarkParseUUID_ns_op":488.3,"BenchmarkParseUUID_B_op":0,"BenchmarkParseUUID_allocs_op":0,"BenchmarkUUID7_ns_op":97.69,"BenchmarkUUID7_B_op":0,"BenchmarkUUID7_allocs_op":0},"status":"discard","description":"Use time.Unix seconds/nanoseconds instead of time.UnixMilli in CLI parse","timestamp":1782062277674,"segment":0,"confidence":7.148803686383723,"asi":{"hypothesis":"Constructing the parse timestamp via time.Unix(seconds,nanoseconds) might avoid time.UnixMilli helper overhead while preserving exact time for every millisecond value.","rollback_reason":"Correctness checks passed, but primary geomean regressed versus current best and parse did not improve. UnixMilli is already efficient or the extra div/mod is more expensive.","next_action_hint":"Keep time.UnixMilli in parseUUID. Further parse wins likely require reducing time zone/Date/Clock costs or output formatting, not timestamp construction."}}
{"run":43,"commit":"81559d6","metric":148.71690247635908,"metrics":{"BenchmarkDecodeBase58_ns_op":13.55,"BenchmarkDecodeBase58_B_op":0,"BenchmarkDecodeBase58_allocs_op":0,"BenchmarkEncodeBase58_ns_op":39.42,"BenchmarkEncodeBase58_B_op":24,"BenchmarkEncodeBase58_allocs_op":1,"BenchmarkEncodeDecodeBase58_ns_op":57.39,"BenchmarkEncodeDecodeBase58_B_op":24,"BenchmarkEncodeDecodeBase58_allocs_op":1,"BenchmarkFromTime_ns_op":64.87,"BenchmarkFromTime_B_op":0,"BenchmarkFromTime_allocs_op":0,"BenchmarkGenerateUUID_ns_op":538.1,"BenchmarkGenerateUUID_B_op":24,"BenchmarkGenerateUUID_allocs_op":1,"BenchmarkMainGenerate_ns_op":537.8,"BenchmarkMainGenerate_B_op":24,"BenchmarkMainGenerate_allocs_op":1,"BenchmarkMainHelp_ns_op":371,"BenchmarkMainHelp_B_op":0,"BenchmarkMainHelp_allocs_op":0,"BenchmarkMainParse_ns_op":491.8,"BenchmarkMainParse_B_op":0,"BenchmarkMainParse_allocs_op":0,"BenchmarkNewString_ns_op":154.3,"BenchmarkNewString_B_op":24,"BenchmarkNewString_allocs_op":1,"BenchmarkParseUUID_ns_op":492.8,"BenchmarkParseUUID_B_op":0,"BenchmarkParseUUID_allocs_op":0,"BenchmarkUUID7_ns_op":98.57,"BenchmarkUUID7_B_op":0,"BenchmarkUUID7_allocs_op":0},"status":"discard","description":"Combine Base58 pair invalid checks into one branch","timestamp":1782062375433,"segment":0,"confidence":7.201608029365164,"asi":{"hypothesis":"On valid inputs, checking `v0 == 0 || v1 == 0` once per Base58 pair may reduce branch count versus separate invalid checks while preserving left-to-right error behavior through a cold helper.","rollback_reason":"Correctness checks passed, but primary geomean regressed and the extra helper/compound condition did not improve DecodeBase58. The compiler likely handles separate predictable branches better.","next_action_hint":"Keep the existing explicit per-character invalid checks in the paired decoder."}}
{"run":44,"commit":"6a5f3db","metric":141.92597150029962,"metrics":{"BenchmarkDecodeBase58_ns_op":13.79,"BenchmarkDecodeBase58_B_op":0,"BenchmarkDecodeBase58_allocs_op":0,"BenchmarkEncodeBase58_ns_op":31.61,"BenchmarkEncodeBase58_B_op":24,"BenchmarkEncodeBase58_allocs_op":1,"BenchmarkEncodeDecodeBase58_ns_op":49.2,"BenchmarkEncodeDecodeBase58_B_op":24,"BenchmarkEncodeDecodeBase58_allocs_op":1,"BenchmarkFromTime_ns_op":64.97,"BenchmarkFromTime_B_op":0,"BenchmarkFromTime_allocs_op":0,"BenchmarkGenerateUUID_ns_op":523.3,"BenchmarkGenerateUUID_B_op":24,"BenchmarkGenerateUUID_allocs_op":1,"BenchmarkMainGenerate_ns_op":523.8,"BenchmarkMainGenerate_B_op":24,"BenchmarkMainGenerate_allocs_op":1,"BenchmarkMainHelp_ns_op":361.3,"BenchmarkMainHelp_B_op":0,"BenchmarkMainHelp_allocs_op":0,"BenchmarkMainParse_ns_op":489,"BenchmarkMainParse_B_op":0,"BenchmarkMainParse_allocs_op":0,"BenchmarkNewString_ns_op":144.6,"BenchmarkNewString_B_op":24,"BenchmarkNewString_allocs_op":1,"BenchmarkParseUUID_ns_op":488,"BenchmarkParseUUID_B_op":0,"BenchmarkParseUUID_allocs_op":0,"BenchmarkUUID7_ns_op":98.84,"BenchmarkUUID7_B_op":0,"BenchmarkUUID7_allocs_op":0},"status":"keep","description":"Always emit all fixed Base58 encoder chunks","timestamp":1782062439199,"segment":0,"confidence":7.280870398289495,"asi":{"hypothesis":"Because hqid7's string format is always 22 Base58 digits plus separator, the encoder can always run the six 58^4 chunk passes and fill every raw digit instead of zero-initializing/padding and branching on remaining value.","learned":"EncodeBase58 improved strongly (~38ns to ~32ns) and primary geomean reached ~141.9. This is a general fixed-width formatting optimization; zero and small UUIDs still encode correctly because later zero chunks emit Base58 zero digits ('1')."}}
{"run":45,"commit":"02cc6c2","metric":139.88787873732335,"metrics":{"BenchmarkDecodeBase58_ns_op":13.75,"BenchmarkDecodeBase58_B_op":0,"BenchmarkDecodeBase58_allocs_op":0,"BenchmarkEncodeBase58_ns_op":31.17,"BenchmarkEncodeBase58_B_op":24,"BenchmarkEncodeBase58_allocs_op":1,"BenchmarkEncodeDecodeBase58_ns_op":46.3,"BenchmarkEncodeDecodeBase58_B_op":24,"BenchmarkEncodeDecodeBase58_allocs_op":1,"BenchmarkFromTime_ns_op":65.02,"BenchmarkFromTime_B_op":0,"BenchmarkFromTime_allocs_op":0,"BenchmarkGenerateUUID_ns_op":513.4,"BenchmarkGenerateUUID_B_op":24,"BenchmarkGenerateUUID_allocs_op":1,"BenchmarkMainGenerate_ns_op":519.3,"BenchmarkMainGenerate_B_op":24,"BenchmarkMainGenerate_allocs_op":1,"BenchmarkMainHelp_ns_op":361.2,"BenchmarkMainHelp_B_op":0,"BenchmarkMainHelp_allocs_op":0,"BenchmarkMainParse_ns_op":483.5,"BenchmarkMainParse_B_op":0,"BenchmarkMainParse_allocs_op":0,"BenchmarkNewString_ns_op":141.7,"BenchmarkNewString_B_op":24,"BenchmarkNewString_allocs_op":1,"BenchmarkParseUUID_ns_op":482.5,"BenchmarkParseUUID_B_op":0,"BenchmarkParseUUID_allocs_op":0,"BenchmarkUUID7_ns_op":97.73,"BenchmarkUUID7_B_op":0,"BenchmarkUUID7_allocs_op":0},"status":"keep","description":"Split final Base58 encode chunk to remove per-chunk branch","timestamp":1782062505938,"segment":0,"confidence":7.396891791439062,"asi":{"hypothesis":"After making EncodeBase58 always emit fixed chunks, the only variable digit logic is the final two-character chunk. Splitting that final pass out should remove the `if i >= 3` branch from the five full chunks while preserving fixed-width output.","learned":"Primary geomean improved to ~139.9 and EncodeBase58/EncodeDecode improved modestly. The fixed-width chunk encoder benefits from straight-line full chunks plus a small final partial chunk."}}
