{"run":11,"commit":"e104538","metric":353.1312166657445,"metrics":{"BenchmarkDecodeBase58_ns_op":140.5,"BenchmarkDecodeBase58_B_op":48,"BenchmarkDecodeBase58_allocs_op":1,"BenchmarkEncodeBase58_ns_op":288.1,"BenchmarkEncodeBase58_B_op":24,"BenchmarkEncodeBase58_allocs_op":1,"BenchmarkEncodeDecodeBase58_ns_op":409,"BenchmarkEncodeDecodeBase58_B_op":72,"BenchmarkEncodeDecodeBase58_allocs_op":2,"BenchmarkFromTime_ns_op":70.93,"BenchmarkFromTime_B_op":0,"BenchmarkFromTime_allocs_op":0,"BenchmarkGenerateUUID_ns_op":832.5,"BenchmarkGenerateUUID_B_op":24,"BenchmarkGenerateUUID_allocs_op":1,"BenchmarkMainGenerate_ns_op":824.1,"BenchmarkMainGenerate_B_op":24,"BenchmarkMainGenerate_allocs_op":1,"BenchmarkMainHelp_ns_op":395.9,"BenchmarkMainHelp_B_op":0,"BenchmarkMainHelp_allocs_op":0,"BenchmarkMainParse_ns_op":882.1,"BenchmarkMainParse_B_op":48,"BenchmarkMainParse_allocs_op":1,"BenchmarkNewString_ns_op":396.5,"BenchmarkNewString_B_op":24,"BenchmarkNewString_allocs_op":1,"BenchmarkParseUUID_ns_op":879.8,"BenchmarkParseUUID_B_op":48,"BenchmarkParseUUID_allocs_op":1,"BenchmarkUUID7_ns_op":108.5,"BenchmarkUUID7_B_op":0,"BenchmarkUUID7_allocs_op":0},"status":"keep","description":"Format parse output into a stack byte buffer with append helpers","timestamp":1781993619958,"segment":0,"confidence":8.81007414657998,"asi":{"hypothesis":"Replacing parseUUID's fmt.Fprintf and time.Format string creation with AppendFormat/strconv.Append* into a stack byte buffer should preserve exact CLI output while avoiding formatting allocations and reflection overhead.","learned":"Large general parse win: ParseUUID/MainParse dropped from ~1.3us and 10 allocations to ~0.88us and 1 allocation. The remaining allocation is likely DecodeBase58's separator removal/base58 decode path or os.File.Write escape of the buffer.","next_action_hint":"Next investigate whether DecodeBase58 can remove only the separator allocation while retaining dependency speed, or reduce the final parse buffer/write allocation."}}
{"run":12,"commit":"cda0938","metric":351.2140136311867,"metrics":{"BenchmarkDecodeBase58_ns_op":137.1,"BenchmarkDecodeBase58_B_op":48,"BenchmarkDecodeBase58_allocs_op":1,"BenchmarkEncodeBase58_ns_op":273.5,"BenchmarkEncodeBase58_B_op":24,"BenchmarkEncodeBase58_allocs_op":1,"BenchmarkEncodeDecodeBase58_ns_op":407.6,"BenchmarkEncodeDecodeBase58_B_op":72,"BenchmarkEncodeDecodeBase58_allocs_op":2,"BenchmarkFromTime_ns_op":71.94,"BenchmarkFromTime_B_op":0,"BenchmarkFromTime_allocs_op":0,"BenchmarkGenerateUUID_ns_op":815,"BenchmarkGenerateUUID_B_op":24,"BenchmarkGenerateUUID_allocs_op":1,"BenchmarkMainGenerate_ns_op":830,"BenchmarkMainGenerate_B_op":24,"BenchmarkMainGenerate_allocs_op":1,"BenchmarkMainHelp_ns_op":393.9,"BenchmarkMainHelp_B_op":0,"BenchmarkMainHelp_allocs_op":0,"BenchmarkMainParse_ns_op":945.3,"BenchmarkMainParse_B_op":48,"BenchmarkMainParse_allocs_op":1,"BenchmarkNewString_ns_op":396.3,"BenchmarkNewString_B_op":24,"BenchmarkNewString_allocs_op":1,"BenchmarkParseUUID_ns_op":860.5,"BenchmarkParseUUID_B_op":48,"BenchmarkParseUUID_allocs_op":1,"BenchmarkUUID7_ns_op":106.2,"BenchmarkUUID7_B_op":0,"BenchmarkUUID7_allocs_op":0},"status":"keep","description":"Specialize fixed-width binary and hex append helpers for parse output","timestamp":1781993687625,"segment":0,"confidence":6.654775263777769,"asi":{"hypothesis":"The generic appendFixedBase helper divides by a dynamic base for binary and hex parse output. Specialized bit-shift based appendBitsFixed and appendHexFixed should preserve exact formatting while reducing parse formatting overhead.","learned":"Primary geomean improved slightly to ~351.2 and ParseUUID improved to ~860ns. MainParse regressed in this sample, but the overall primary metric improved and allocations stayed at one. Gains are small and likely near noise; future confirmation may be useful.","next_action_hint":"Continue with broader optimizations: investigate faster safe DecodeBase58 paths or reduce generate/output overhead. Avoid relying heavily on this small parse-helper gain without more runs if subsequent noise contradicts it."}}
{"run":13,"commit":"e58f898","metric":326.7835038716696,"metrics":{"BenchmarkDecodeBase58_ns_op":86.91,"BenchmarkDecodeBase58_B_op":0,"BenchmarkDecodeBase58_allocs_op":0,"BenchmarkEncodeBase58_ns_op":276.1,"BenchmarkEncodeBase58_B_op":24,"BenchmarkEncodeBase58_allocs_op":1,"BenchmarkEncodeDecodeBase58_ns_op":361.5,"BenchmarkEncodeDecodeBase58_B_op":24,"BenchmarkEncodeDecodeBase58_allocs_op":1,"BenchmarkFromTime_ns_op":70.64,"BenchmarkFromTime_B_op":0,"BenchmarkFromTime_allocs_op":0,"BenchmarkGenerateUUID_ns_op":812.2,"BenchmarkGenerateUUID_B_op":24,"BenchmarkGenerateUUID_allocs_op":1,"BenchmarkMainGenerate_ns_op":842.3,"BenchmarkMainGenerate_B_op":24,"BenchmarkMainGenerate_allocs_op":1,"BenchmarkMainHelp_ns_op":388.5,"BenchmarkMainHelp_B_op":0,"BenchmarkMainHelp_allocs_op":0,"BenchmarkMainParse_ns_op":811.6,"BenchmarkMainParse_B_op":0,"BenchmarkMainParse_allocs_op":0,"BenchmarkNewString_ns_op":399.1,"BenchmarkNewString_B_op":24,"BenchmarkNewString_allocs_op":1,"BenchmarkParseUUID_ns_op":808.5,"BenchmarkParseUUID_B_op":0,"BenchmarkParseUUID_allocs_op":0,"BenchmarkUUID7_ns_op":106.4,"BenchmarkUUID7_B_op":0,"BenchmarkUUID7_allocs_op":0},"status":"keep","description":"Implement fast fixed-width Base58 decoder using uint32 limbs","timestamp":1781993814697,"segment":0,"confidence":7.010147576671634,"asi":{"hypothesis":"A fixed-width hqid7 decoder can mirror mr-tron/base58's uint32-limb algorithm without allocating the separator-stripped string, rune slice, output slice, or intermediate buffers. Because hqid7 input is always exactly 22 Base58 digits plus separator, the low 128 bits map directly to the final four limbs while preserving valid decode behavior and matching dependency-style invalid digit errors.","learned":"This is a large general win: DecodeBase58 dropped to ~87ns and zero allocations, EncodeDecode to ~362ns and one allocation, and parse paths became zero-allocation. Unlike the earlier naive byte-array decoder, uint32 limbs keep the conversion loop small and fast.","next_action_hint":"Consider micro-optimizing the decoder further by unrolling six limb updates or removing fmt imports with custom errors only if invalid-error text remains acceptable; also revisit EncodeBase58 base conversion loop."}}
{"run":14,"commit":"54b8377","metric":321.1742691468422,"metrics":{"BenchmarkDecodeBase58_ns_op":69.41,"BenchmarkDecodeBase58_B_op":0,"BenchmarkDecodeBase58_allocs_op":0,"BenchmarkEncodeBase58_ns_op":277.5,"BenchmarkEncodeBase58_B_op":24,"BenchmarkEncodeBase58_allocs_op":1,"BenchmarkEncodeDecodeBase58_ns_op":341.1,"BenchmarkEncodeDecodeBase58_B_op":24,"BenchmarkEncodeDecodeBase58_allocs_op":1,"BenchmarkFromTime_ns_op":73.13,"BenchmarkFromTime_B_op":0,"BenchmarkFromTime_allocs_op":0,"BenchmarkGenerateUUID_ns_op":841.7,"BenchmarkGenerateUUID_B_op":24,"BenchmarkGenerateUUID_allocs_op":1,"BenchmarkMainGenerate_ns_op":839.5,"BenchmarkMainGenerate_B_op":24,"BenchmarkMainGenerate_allocs_op":1,"BenchmarkMainHelp_ns_op":392.3,"BenchmarkMainHelp_B_op":0,"BenchmarkMainHelp_allocs_op":0,"BenchmarkMainParse_ns_op":802.3,"BenchmarkMainParse_B_op":0,"BenchmarkMainParse_allocs_op":0,"BenchmarkNewString_ns_op":396.3,"BenchmarkNewString_B_op":24,"BenchmarkNewString_allocs_op":1,"BenchmarkParseUUID_ns_op":817.9,"BenchmarkParseUUID_B_op":0,"BenchmarkParseUUID_allocs_op":0,"BenchmarkUUID7_ns_op":108.3,"BenchmarkUUID7_B_op":0,"BenchmarkUUID7_allocs_op":0},"status":"keep","description":"Unroll fixed-width Base58 decoder limb multiplication loop","timestamp":1781993886674,"segment":0,"confidence":7.09845488831785,"asi":{"hypothesis":"DecodeBase58 always updates exactly six uint32 limbs for each of 22 digits, so unrolling the inner limb loop should reduce loop overhead and bounds checks while preserving the same overflow checks and error behavior.","learned":"Unrolling the six-limb multiply/add loop improved DecodeBase58 from ~87ns to ~69ns and EncodeDecode from ~362ns to ~341ns. Primary geomean improved despite some noise/regression in unrelated generate metrics.","next_action_hint":"Consider further decoder micro-optimizations such as processing the two digit ranges without the separator branch, but avoid duplicating too much code unless benchmark confirms a clear win."}}
{"run":15,"commit":"527c3da","metric":303.9935174836711,"metrics":{"BenchmarkDecodeBase58_ns_op":66.31,"BenchmarkDecodeBase58_B_op":0,"BenchmarkDecodeBase58_allocs_op":0,"BenchmarkEncodeBase58_ns_op":262.2,"BenchmarkEncodeBase58_B_op":24,"BenchmarkEncodeBase58_allocs_op":1,"BenchmarkEncodeDecodeBase58_ns_op":330.4,"BenchmarkEncodeDecodeBase58_B_op":24,"BenchmarkEncodeDecodeBase58_allocs_op":1,"BenchmarkFromTime_ns_op":67.1,"BenchmarkFromTime_B_op":0,"BenchmarkFromTime_allocs_op":0,"BenchmarkGenerateUUID_ns_op":773.9,"BenchmarkGenerateUUID_B_op":24,"BenchmarkGenerateUUID_allocs_op":1,"BenchmarkMainGenerate_ns_op":775.8,"BenchmarkMainGenerate_B_op":24,"BenchmarkMainGenerate_allocs_op":1,"BenchmarkMainHelp_ns_op":375.5,"BenchmarkMainHelp_B_op":0,"BenchmarkMainHelp_allocs_op":0,"BenchmarkMainParse_ns_op":763.8,"BenchmarkMainParse_B_op":0,"BenchmarkMainParse_allocs_op":0,"BenchmarkNewString_ns_op":396.8,"BenchmarkNewString_B_op":24,"BenchmarkNewString_allocs_op":1,"BenchmarkParseUUID_ns_op":768.7,"BenchmarkParseUUID_B_op":0,"BenchmarkParseUUID_allocs_op":0,"BenchmarkUUID7_ns_op":101.2,"BenchmarkUUID7_B_op":0,"BenchmarkUUID7_allocs_op":0},"status":"keep","description":"Split Base58 decode loop around separator to remove per-digit branch","timestamp":1781993975902,"segment":0,"confidence":6.446112682715714,"asi":{"hypothesis":"DecodeBase58 always has a separator at index 9; splitting the loop into [0:9] and [10:23] removes a branch from each digit while preserving validation order and error behavior.","learned":"Primary geomean improved to ~304. DecodeBase58 improved modestly (~69ns to ~66ns), but this run also showed broad favorable noise across UUID/generate/help; the decode-specific improvement is plausible but smaller than the primary delta suggests.","next_action_hint":"Potential next decoder cleanup: factor duplicated digit body only if inlining preserves speed, or optimize UUID construction/direct byte stores. Also consider rerunning current state later to confirm broad-noise contribution."}}
{"run":16,"commit":"527c3da","metric":306.8083995359566,"metrics":{"BenchmarkDecodeBase58_ns_op":70.85,"BenchmarkDecodeBase58_B_op":0,"BenchmarkDecodeBase58_allocs_op":0,"BenchmarkEncodeBase58_ns_op":264.6,"BenchmarkEncodeBase58_B_op":24,"BenchmarkEncodeBase58_allocs_op":1,"BenchmarkEncodeDecodeBase58_ns_op":330.8,"BenchmarkEncodeDecodeBase58_B_op":24,"BenchmarkEncodeDecodeBase58_allocs_op":1,"BenchmarkFromTime_ns_op":67.98,"BenchmarkFromTime_B_op":0,"BenchmarkFromTime_allocs_op":0,"BenchmarkGenerateUUID_ns_op":803.9,"BenchmarkGenerateUUID_B_op":24,"BenchmarkGenerateUUID_allocs_op":1,"BenchmarkMainGenerate_ns_op":772.4,"BenchmarkMainGenerate_B_op":24,"BenchmarkMainGenerate_allocs_op":1,"BenchmarkMainHelp_ns_op":392.3,"BenchmarkMainHelp_B_op":0,"BenchmarkMainHelp_allocs_op":0,"BenchmarkMainParse_ns_op":770.4,"BenchmarkMainParse_B_op":0,"BenchmarkMainParse_allocs_op":0,"BenchmarkNewString_ns_op":372.2,"BenchmarkNewString_B_op":24,"BenchmarkNewString_allocs_op":1,"BenchmarkParseUUID_ns_op":760.9,"BenchmarkParseUUID_B_op":0,"BenchmarkParseUUID_allocs_op":0,"BenchmarkUUID7_ns_op":101.2,"BenchmarkUUID7_B_op":0,"BenchmarkUUID7_allocs_op":0},"status":"discard","description":"Return decoded UUID via composite literal instead of binary.BigEndian stores","timestamp":1781994050004,"segment":0,"confidence":6.106547394813339,"asi":{"hypothesis":"Constructing the decoded UUID with a composite literal from the four uint32 limbs may avoid binary.BigEndian.PutUint32 call overhead at the end of DecodeBase58.","rollback_reason":"Correctness checks passed, but primary geomean regressed versus current best (306.81 vs 303.99). DecodeBase58 itself worsened from ~66ns to ~71ns, suggesting the compiler's BigEndian stores are already optimal or the composite literal adds overhead.","next_action_hint":"Keep binary.BigEndian.PutUint32 for UUID assembly. Future decoder experiments should focus on digit processing, overflow checks, or valid-path error branch structure rather than final UUID construction."}}
{"run":17,"commit":"527c3da","metric":320.005092790009,"metrics":{"BenchmarkDecodeBase58_ns_op":68.27,"BenchmarkDecodeBase58_B_op":0,"BenchmarkDecodeBase58_allocs_op":0,"BenchmarkEncodeBase58_ns_op":297,"BenchmarkEncodeBase58_B_op":24,"BenchmarkEncodeBase58_allocs_op":1,"BenchmarkEncodeDecodeBase58_ns_op":344,"BenchmarkEncodeDecodeBase58_B_op":24,"BenchmarkEncodeDecodeBase58_allocs_op":1,"BenchmarkFromTime_ns_op":70.27,"BenchmarkFromTime_B_op":0,"BenchmarkFromTime_allocs_op":0,"BenchmarkGenerateUUID_ns_op":813.5,"BenchmarkGenerateUUID_B_op":24,"BenchmarkGenerateUUID_allocs_op":1,"BenchmarkMainGenerate_ns_op":830.7,"BenchmarkMainGenerate_B_op":24,"BenchmarkMainGenerate_allocs_op":1,"BenchmarkMainHelp_ns_op":396.6,"BenchmarkMainHelp_B_op":0,"BenchmarkMainHelp_allocs_op":0,"BenchmarkMainParse_ns_op":803,"BenchmarkMainParse_B_op":0,"BenchmarkMainParse_allocs_op":0,"BenchmarkNewString_ns_op":397.2,"BenchmarkNewString_B_op":24,"BenchmarkNewString_allocs_op":1,"BenchmarkParseUUID_ns_op":803.8,"BenchmarkParseUUID_B_op":0,"BenchmarkParseUUID_allocs_op":0,"BenchmarkUUID7_ns_op":107,"BenchmarkUUID7_B_op":0,"BenchmarkUUID7_allocs_op":0},"status":"discard","description":"Try big-endian high-water fixed Base58 encoder loop","timestamp":1781994123264,"segment":0,"confidence":6.605253970231084,"asi":{"hypothesis":"A corrected big-endian/high-water Base58 encode loop like mr-tron/base58's stack algorithm might avoid the little-endian reverse/raw fill work while preserving the exact fixed-width padded output.","rollback_reason":"Correctness checks passed, but primary geomean regressed versus the current best (320.0 vs 304.0) and EncodeBase58 slowed materially (~262ns best sample to ~297ns). The high-water loop is correct but slower than the existing little-endian encoder for this fixed 16-byte input.","next_action_hint":"Keep the little-endian encoder. Future encode work should target reducing divisions/modulo or special-casing by general input structure, not the big-endian high-water formulation."}}
{"run":18,"commit":"ae15448","metric":288.4351994857038,"metrics":{"BenchmarkDecodeBase58_ns_op":62.34,"BenchmarkDecodeBase58_B_op":0,"BenchmarkDecodeBase58_allocs_op":0,"BenchmarkEncodeBase58_ns_op":246.2,"BenchmarkEncodeBase58_B_op":24,"BenchmarkEncodeBase58_allocs_op":1,"BenchmarkEncodeDecodeBase58_ns_op":318.1,"BenchmarkEncodeDecodeBase58_B_op":24,"BenchmarkEncodeDecodeBase58_allocs_op":1,"BenchmarkFromTime_ns_op":63.58,"BenchmarkFromTime_B_op":0,"BenchmarkFromTime_allocs_op":0,"BenchmarkGenerateUUID_ns_op":737.4,"BenchmarkGenerateUUID_B_op":24,"BenchmarkGenerateUUID_allocs_op":1,"BenchmarkMainGenerate_ns_op":744.2,"BenchmarkMainGenerate_B_op":24,"BenchmarkMainGenerate_allocs_op":1,"BenchmarkMainHelp_ns_op":367,"BenchmarkMainHelp_B_op":0,"BenchmarkMainHelp_allocs_op":0,"BenchmarkMainParse_ns_op":737.6,"BenchmarkMainParse_B_op":0,"BenchmarkMainParse_allocs_op":0,"BenchmarkNewString_ns_op":349.5,"BenchmarkNewString_B_op":24,"BenchmarkNewString_allocs_op":1,"BenchmarkParseUUID_ns_op":735.5,"BenchmarkParseUUID_B_op":0,"BenchmarkParseUUID_allocs_op":0,"BenchmarkUUID7_ns_op":96.98,"BenchmarkUUID7_B_op":0,"BenchmarkUUID7_allocs_op":0},"status":"keep","description":"Use 256-entry Base58 decode lookup to remove high-bit fast-path branch","timestamp":1782059494494,"segment":0,"confidence":6.82102629922282,"asi":{"hypothesis":"Expanding the Base58 decode lookup table to cover all byte values lets the valid fast path index directly without checking c > 127 before every lookup, while still returning the same high-bit invalid digit error when the decoded value is zero.","learned":"Correctness checks passed and DecodeBase58 improved to ~62ns with zero allocations; broad benchmark sample also improved the primary geomean to ~288.4. This is a general valid-path branch reduction, not benchmark-specific."}}
{"run":19,"commit":"340aa8c","metric":220.85565318067506,"metrics":{"BenchmarkDecodeBase58_ns_op":62.35,"BenchmarkDecodeBase58_B_op":0,"BenchmarkDecodeBase58_allocs_op":0,"BenchmarkEncodeBase58_ns_op":81.94,"BenchmarkEncodeBase58_B_op":24,"BenchmarkEncodeBase58_allocs_op":1,"BenchmarkEncodeDecodeBase58_ns_op":152.2,"BenchmarkEncodeDecodeBase58_B_op":24,"BenchmarkEncodeDecodeBase58_allocs_op":1,"BenchmarkFromTime_ns_op":63.82,"BenchmarkFromTime_B_op":0,"BenchmarkFromTime_allocs_op":0,"BenchmarkGenerateUUID_ns_op":574.2,"BenchmarkGenerateUUID_B_op":24,"BenchmarkGenerateUUID_allocs_op":1,"BenchmarkMainGenerate_ns_op":588.5,"BenchmarkMainGenerate_B_op":24,"BenchmarkMainGenerate_allocs_op":1,"BenchmarkMainHelp_ns_op":365.7,"BenchmarkMainHelp_B_op":0,"BenchmarkMainHelp_allocs_op":0,"BenchmarkMainParse_ns_op":738.7,"BenchmarkMainParse_B_op":0,"BenchmarkMainParse_allocs_op":0,"BenchmarkNewString_ns_op":189.9,"BenchmarkNewString_B_op":24,"BenchmarkNewString_allocs_op":1,"BenchmarkParseUUID_ns_op":739.4,"BenchmarkParseUUID_B_op":0,"BenchmarkParseUUID_allocs_op":0,"BenchmarkUUID7_ns_op":95.87,"BenchmarkUUID7_B_op":0,"BenchmarkUUID7_allocs_op":0},"status":"keep","description":"Encode Base58 with repeated division of uint32 limbs","timestamp":1782059569499,"segment":0,"confidence":7.891327490321725,"asi":{"hypothesis":"For a fixed 16-byte UUID, repeated division of four 32-bit limbs by 58 should need fewer divisions than the byte-by-byte base conversion loop while preserving canonical fixed-width Base58 output for every UUID.","learned":"Large general encode win: EncodeBase58 dropped from ~246ns to ~82ns and NewString/generate/encode-decode improved accordingly. Tests including exhaustive order/roundtrip checks passed, confirming the limb division output matches the original format."}}
{"run":20,"commit":"340aa8c","metric":222.7445457318196,"metrics":{"BenchmarkDecodeBase58_ns_op":63.15,"BenchmarkDecodeBase58_B_op":0,"BenchmarkDecodeBase58_allocs_op":0,"BenchmarkEncodeBase58_ns_op":83.29,"BenchmarkEncodeBase58_B_op":24,"BenchmarkEncodeBase58_allocs_op":1,"BenchmarkEncodeDecodeBase58_ns_op":156.2,"BenchmarkEncodeDecodeBase58_B_op":24,"BenchmarkEncodeDecodeBase58_allocs_op":1,"BenchmarkFromTime_ns_op":64.86,"BenchmarkFromTime_B_op":0,"BenchmarkFromTime_allocs_op":0,"BenchmarkGenerateUUID_ns_op":572.9,"BenchmarkGenerateUUID_B_op":24,"BenchmarkGenerateUUID_allocs_op":1,"BenchmarkMainGenerate_ns_op":573.1,"BenchmarkMainGenerate_B_op":24,"BenchmarkMainGenerate_allocs_op":1,"BenchmarkMainHelp_ns_op":370.4,"BenchmarkMainHelp_B_op":0,"BenchmarkMainHelp_allocs_op":0,"BenchmarkMainParse_ns_op":729.3,"BenchmarkMainParse_B_op":0,"BenchmarkMainParse_allocs_op":0,"BenchmarkNewString_ns_op":198,"BenchmarkNewString_B_op":24,"BenchmarkNewString_allocs_op":1,"BenchmarkParseUUID_ns_op":732.2,"BenchmarkParseUUID_B_op":0,"BenchmarkParseUUID_allocs_op":0,"BenchmarkUUID7_ns_op":97.74,"BenchmarkUUID7_B_op":0,"BenchmarkUUID7_allocs_op":0},"status":"discard","description":"Fill final Base58 output buffer directly for limb encoder","timestamp":1782059624778,"segment":0,"confidence":8.57247217377077,"asi":{"hypothesis":"With the new limb encoder, writing Base58 digits directly into the final 23-byte buffer might avoid the raw buffer plus two copies.","rollback_reason":"Correctness checks passed, but primary geomean worsened versus the current best and EncodeBase58/NewString slowed. The per-digit separator-index branch appears more expensive than copying the 22-byte raw buffer.","next_action_hint":"Keep the raw buffer plus copy assembly. Future encode work should target the division loop or direct string construction without per-digit branches."}}
{"run":21,"commit":"340aa8c","metric":231.34679807595796,"metrics":{"BenchmarkDecodeBase58_ns_op":63.91,"BenchmarkDecodeBase58_B_op":0,"BenchmarkDecodeBase58_allocs_op":0,"BenchmarkEncodeBase58_ns_op":87.75,"BenchmarkEncodeBase58_B_op":24,"BenchmarkEncodeBase58_allocs_op":1,"BenchmarkEncodeDecodeBase58_ns_op":157.2,"BenchmarkEncodeDecodeBase58_B_op":24,"BenchmarkEncodeDecodeBase58_allocs_op":1,"BenchmarkFromTime_ns_op":74.15,"BenchmarkFromTime_B_op":16,"BenchmarkFromTime_allocs_op":1,"BenchmarkGenerateUUID_ns_op":597.9,"BenchmarkGenerateUUID_B_op":40,"BenchmarkGenerateUUID_allocs_op":2,"BenchmarkMainGenerate_ns_op":611.2,"BenchmarkMainGenerate_B_op":40,"BenchmarkMainGenerate_allocs_op":2,"BenchmarkMainHelp_ns_op":366.6,"BenchmarkMainHelp_B_op":0,"BenchmarkMainHelp_allocs_op":0,"BenchmarkMainParse_ns_op":737,"BenchmarkMainParse_B_op":0,"BenchmarkMainParse_allocs_op":0,"BenchmarkNewString_ns_op":202.9,"BenchmarkNewString_B_op":40,"BenchmarkNewString_allocs_op":2,"BenchmarkParseUUID_ns_op":741,"BenchmarkParseUUID_B_op":0,"BenchmarkParseUUID_allocs_op":0,"BenchmarkUUID7_ns_op":104.7,"BenchmarkUUID7_B_op":16,"BenchmarkUUID7_allocs_op":1},"status":"discard","description":"Call crypto/rand Reader.Read directly for UUID randomness","timestamp":1782059697585,"segment":0,"confidence":9.291288600181108,"asi":{"hypothesis":"Calling crypto/rand.Reader.Read directly might avoid helper overhead in rand.Read for the 8 random UUID bytes.","rollback_reason":"It regressed primary metric and introduced one allocation on every UUID generation path, likely from interface method call/escape behavior. rand.Read is better optimized here.","next_action_hint":"Keep rand.Read. Future UUID generation work should focus on timestamp arithmetic or output composition, not direct Reader.Read."}}
