{"run":57,"commit":"dd30228","metric":123.90347820184293,"metrics":{"BenchmarkDecodeBase58_ns_op":8.436,"BenchmarkDecodeBase58_B_op":0,"BenchmarkDecodeBase58_allocs_op":0,"BenchmarkEncodeBase58_ns_op":21.2,"BenchmarkEncodeBase58_B_op":24,"BenchmarkEncodeBase58_allocs_op":1,"BenchmarkEncodeDecodeBase58_ns_op":32.55,"BenchmarkEncodeDecodeBase58_B_op":24,"BenchmarkEncodeDecodeBase58_allocs_op":1,"BenchmarkFromTime_ns_op":64.12,"BenchmarkFromTime_B_op":0,"BenchmarkFromTime_allocs_op":0,"BenchmarkGenerateUUID_ns_op":519.7,"BenchmarkGenerateUUID_B_op":24,"BenchmarkGenerateUUID_allocs_op":1,"BenchmarkMainGenerate_ns_op":525.9,"BenchmarkMainGenerate_B_op":24,"BenchmarkMainGenerate_allocs_op":1,"BenchmarkMainHelp_ns_op":365.8,"BenchmarkMainHelp_B_op":0,"BenchmarkMainHelp_allocs_op":0,"BenchmarkMainParse_ns_op":473.9,"BenchmarkMainParse_B_op":0,"BenchmarkMainParse_allocs_op":0,"BenchmarkNewString_ns_op":129.9,"BenchmarkNewString_B_op":24,"BenchmarkNewString_allocs_op":1,"BenchmarkParseUUID_ns_op":473,"BenchmarkParseUUID_B_op":0,"BenchmarkParseUUID_allocs_op":0,"BenchmarkUUID7_ns_op":97.24,"BenchmarkUUID7_B_op":0,"BenchmarkUUID7_allocs_op":0},"status":"discard","description":"Specialize small decimal formatting in CLI parse output","timestamp":1782063774844,"segment":0,"confidence":10.8435044836146,"asi":{"hypothesis":"CLI parse only formats small decimal fields for version, variant, and sub-millisecond precision; replacing strconv.AppendUint with a fixed small integer appender should reduce formatting overhead while preserving decimal output for all possible 4-bit/12-bit values.","rollback_reason":"Correctness checks passed and parse was roughly similar, but primary geomean regressed versus current best due slower encode/decode/generate samples. The custom decimal helper is not a durable primary improvement.","next_action_hint":"Keep strconv.AppendUint for these small parse fields. Future parse work should focus on timestamp/time-zone handling if revisited."}}
{"run":58,"commit":"dd30228","metric":122.95873822448468,"metrics":{"BenchmarkDecodeBase58_ns_op":8.441,"BenchmarkDecodeBase58_B_op":0,"BenchmarkDecodeBase58_allocs_op":0,"BenchmarkEncodeBase58_ns_op":21.4,"BenchmarkEncodeBase58_B_op":24,"BenchmarkEncodeBase58_allocs_op":1,"BenchmarkEncodeDecodeBase58_ns_op":31.89,"BenchmarkEncodeDecodeBase58_B_op":24,"BenchmarkEncodeDecodeBase58_allocs_op":1,"BenchmarkFromTime_ns_op":63.69,"BenchmarkFromTime_B_op":0,"BenchmarkFromTime_allocs_op":0,"BenchmarkGenerateUUID_ns_op":508.9,"BenchmarkGenerateUUID_B_op":24,"BenchmarkGenerateUUID_allocs_op":1,"BenchmarkMainGenerate_ns_op":508.7,"BenchmarkMainGenerate_B_op":24,"BenchmarkMainGenerate_allocs_op":1,"BenchmarkMainHelp_ns_op":357.6,"BenchmarkMainHelp_B_op":0,"BenchmarkMainHelp_allocs_op":0,"BenchmarkMainParse_ns_op":472.7,"BenchmarkMainParse_B_op":0,"BenchmarkMainParse_allocs_op":0,"BenchmarkNewString_ns_op":133.1,"BenchmarkNewString_B_op":24,"BenchmarkNewString_allocs_op":1,"BenchmarkParseUUID_ns_op":471.8,"BenchmarkParseUUID_B_op":0,"BenchmarkParseUUID_allocs_op":0,"BenchmarkUUID7_ns_op":96.34,"BenchmarkUUID7_B_op":0,"BenchmarkUUID7_allocs_op":0},"status":"discard","description":"Mark Base58 invalid-digit helpers noinline","timestamp":1782063839475,"segment":0,"confidence":10.328335890246162,"asi":{"hypothesis":"Marking the cold Base58 invalid-character helpers noinline may reduce valid-path code size and improve instruction-cache behavior while preserving all error behavior.","rollback_reason":"Correctness checks passed, but primary geomean regressed and DecodeBase58 was slightly slower. The compiler's default inlining decisions are better here; forcing calls hurts more than any code-size benefit.","next_action_hint":"Keep invalidBase58Quad/invalidBase58Digit without noinline directives."}}
{"run":59,"commit":"53cad60","metric":120.90417769593725,"metrics":{"BenchmarkDecodeBase58_ns_op":8.107,"BenchmarkDecodeBase58_B_op":0,"BenchmarkDecodeBase58_allocs_op":0,"BenchmarkEncodeBase58_ns_op":21.03,"BenchmarkEncodeBase58_B_op":24,"BenchmarkEncodeBase58_allocs_op":1,"BenchmarkEncodeDecodeBase58_ns_op":27.71,"BenchmarkEncodeDecodeBase58_B_op":24,"BenchmarkEncodeDecodeBase58_allocs_op":1,"BenchmarkFromTime_ns_op":64.32,"BenchmarkFromTime_B_op":0,"BenchmarkFromTime_allocs_op":0,"BenchmarkGenerateUUID_ns_op":505.6,"BenchmarkGenerateUUID_B_op":24,"BenchmarkGenerateUUID_allocs_op":1,"BenchmarkMainGenerate_ns_op":512,"BenchmarkMainGenerate_B_op":24,"BenchmarkMainGenerate_allocs_op":1,"BenchmarkMainHelp_ns_op":357.7,"BenchmarkMainHelp_B_op":0,"BenchmarkMainHelp_allocs_op":0,"BenchmarkMainParse_ns_op":470.8,"BenchmarkMainParse_B_op":0,"BenchmarkMainParse_allocs_op":0,"BenchmarkNewString_ns_op":133.6,"BenchmarkNewString_B_op":24,"BenchmarkNewString_allocs_op":1,"BenchmarkParseUUID_ns_op":470.7,"BenchmarkParseUUID_B_op":0,"BenchmarkParseUUID_allocs_op":0,"BenchmarkUUID7_ns_op":96.87,"BenchmarkUUID7_B_op":0,"BenchmarkUUID7_allocs_op":0},"status":"keep","description":"Use Base58 decode pair lookup table for 58^4 chunks","timestamp":1782063969164,"segment":0,"confidence":10.365990079387574,"asi":{"hypothesis":"Now that DecodeBase58 processes fixed 58^4 chunks, a 16-bit pair lookup table can reduce each chunk from four byte lookups and several multiplications to two pair lookups and one multiply, while preserving left-to-right invalid digit errors via a cold pair helper.","learned":"Primary geomean improved to ~120.9; DecodeBase58 reached ~8.1ns and EncodeDecode improved materially. The 128KB table is a memory tradeoff, but it is general for all hqid7 Base58 inputs and correctness checks passed."}}
{"run":60,"commit":"38d332c","metric":120.57641930131652,"metrics":{"BenchmarkDecodeBase58_ns_op":7.833,"BenchmarkDecodeBase58_B_op":0,"BenchmarkDecodeBase58_allocs_op":0,"BenchmarkEncodeBase58_ns_op":21.4,"BenchmarkEncodeBase58_B_op":24,"BenchmarkEncodeBase58_allocs_op":1,"BenchmarkEncodeDecodeBase58_ns_op":27.83,"BenchmarkEncodeDecodeBase58_B_op":24,"BenchmarkEncodeDecodeBase58_allocs_op":1,"BenchmarkFromTime_ns_op":64.09,"BenchmarkFromTime_B_op":0,"BenchmarkFromTime_allocs_op":0,"BenchmarkGenerateUUID_ns_op":507.6,"BenchmarkGenerateUUID_B_op":24,"BenchmarkGenerateUUID_allocs_op":1,"BenchmarkMainGenerate_ns_op":512.7,"BenchmarkMainGenerate_B_op":24,"BenchmarkMainGenerate_allocs_op":1,"BenchmarkMainHelp_ns_op":358.1,"BenchmarkMainHelp_B_op":0,"BenchmarkMainHelp_allocs_op":0,"BenchmarkMainParse_ns_op":471.2,"BenchmarkMainParse_B_op":0,"BenchmarkMainParse_allocs_op":0,"BenchmarkNewString_ns_op":131.7,"BenchmarkNewString_B_op":24,"BenchmarkNewString_allocs_op":1,"BenchmarkParseUUID_ns_op":471,"BenchmarkParseUUID_B_op":0,"BenchmarkParseUUID_allocs_op":0,"BenchmarkUUID7_ns_op":96.17,"BenchmarkUUID7_B_op":0,"BenchmarkUUID7_allocs_op":0},"status":"keep","description":"Use 0xffff sentinel in Base58 decode pair table","timestamp":1782064033715,"segment":0,"confidence":10.389635529045266,"asi":{"hypothesis":"The Base58 pair table can use 0xffff as an invalid sentinel because valid pair values are only 0..3363. This removes the +1/-1 bias adjustment from the valid decode path while preserving invalid-pair fallback error behavior.","learned":"DecodeBase58 improved from ~8.1ns to ~7.8ns and primary geomean improved to ~120.6. The larger pair table remains the same size; the valid path now uses direct pair values with only sentinel comparisons."}}
{"run":61,"commit":"38d332c","metric":124.2371559032568,"metrics":{"BenchmarkDecodeBase58_ns_op":7.928,"BenchmarkDecodeBase58_B_op":0,"BenchmarkDecodeBase58_allocs_op":0,"BenchmarkEncodeBase58_ns_op":24.04,"BenchmarkEncodeBase58_B_op":24,"BenchmarkEncodeBase58_allocs_op":1,"BenchmarkEncodeDecodeBase58_ns_op":31.89,"BenchmarkEncodeDecodeBase58_B_op":24,"BenchmarkEncodeDecodeBase58_allocs_op":1,"BenchmarkFromTime_ns_op":64.81,"BenchmarkFromTime_B_op":0,"BenchmarkFromTime_allocs_op":0,"BenchmarkGenerateUUID_ns_op":509.4,"BenchmarkGenerateUUID_B_op":24,"BenchmarkGenerateUUID_allocs_op":1,"BenchmarkMainGenerate_ns_op":514.8,"BenchmarkMainGenerate_B_op":24,"BenchmarkMainGenerate_allocs_op":1,"BenchmarkMainHelp_ns_op":359.6,"BenchmarkMainHelp_B_op":0,"BenchmarkMainHelp_allocs_op":0,"BenchmarkMainParse_ns_op":475.3,"BenchmarkMainParse_B_op":0,"BenchmarkMainParse_allocs_op":0,"BenchmarkNewString_ns_op":135.1,"BenchmarkNewString_B_op":24,"BenchmarkNewString_allocs_op":1,"BenchmarkParseUUID_ns_op":471.9,"BenchmarkParseUUID_B_op":0,"BenchmarkParseUUID_allocs_op":0,"BenchmarkUUID7_ns_op":96.69,"BenchmarkUUID7_B_op":0,"BenchmarkUUID7_allocs_op":0},"status":"discard","description":"Try fully unrolled Base58 encoder with 58^5 chunks","timestamp":1782064139899,"segment":0,"confidence":11.309780670774984,"asi":{"hypothesis":"A direct fixed-position encoder using 58^5 chunks should reduce the number of 128-bit division passes from six to four plus a final two-digit quotient, potentially beating the current 58^4 encoder despite the larger divisor.","rollback_reason":"Correctness checks passed, but primary geomean regressed and EncodeBase58 slowed significantly (~21ns to ~24ns). The larger 58^5 divisor and extra digit extraction are more expensive than the saved division passes on this platform.","next_action_hint":"Keep the current fully unrolled 58^4 encoder. Future encode attempts should not increase chunk size without a better division strategy."}}
