{"run":46,"commit":"2c66bb1","metric":131.75537859763296,"metrics":{"BenchmarkDecodeBase58_ns_op":13.57,"BenchmarkDecodeBase58_B_op":0,"BenchmarkDecodeBase58_allocs_op":0,"BenchmarkEncodeBase58_ns_op":21.59,"BenchmarkEncodeBase58_B_op":24,"BenchmarkEncodeBase58_allocs_op":1,"BenchmarkEncodeDecodeBase58_ns_op":35.54,"BenchmarkEncodeDecodeBase58_B_op":24,"BenchmarkEncodeDecodeBase58_allocs_op":1,"BenchmarkFromTime_ns_op":64.56,"BenchmarkFromTime_B_op":0,"BenchmarkFromTime_allocs_op":0,"BenchmarkGenerateUUID_ns_op":518.3,"BenchmarkGenerateUUID_B_op":24,"BenchmarkGenerateUUID_allocs_op":1,"BenchmarkMainGenerate_ns_op":518.8,"BenchmarkMainGenerate_B_op":24,"BenchmarkMainGenerate_allocs_op":1,"BenchmarkMainHelp_ns_op":366.2,"BenchmarkMainHelp_B_op":0,"BenchmarkMainHelp_allocs_op":0,"BenchmarkMainParse_ns_op":490.9,"BenchmarkMainParse_B_op":0,"BenchmarkMainParse_allocs_op":0,"BenchmarkNewString_ns_op":133.4,"BenchmarkNewString_B_op":24,"BenchmarkNewString_allocs_op":1,"BenchmarkParseUUID_ns_op":490.2,"BenchmarkParseUUID_B_op":0,"BenchmarkParseUUID_allocs_op":0,"BenchmarkUUID7_ns_op":97.75,"BenchmarkUUID7_B_op":0,"BenchmarkUUID7_allocs_op":0},"status":"keep","description":"Unroll fixed Base58 encoding and write final output positions directly","timestamp":1782062616891,"segment":0,"confidence":7.597308939216152,"asi":{"hypothesis":"The encoder's 22 output digits and separator position are fixed, so fully unrolling the six 58^4 division chunks and writing directly to the final 23-byte buffer should remove loop overhead, raw buffer copies, and separator mapping branches without changing the encoding.","learned":"Very large encode win: EncodeBase58 dropped to ~22ns and EncodeDecode to ~36ns. Direct fixed-position writes are safe because the format is always fixed width; exhaustive roundtrip/order tests passed."}}
{"run":47,"commit":"9e7763a","metric":126.03868161934489,"metrics":{"BenchmarkDecodeBase58_ns_op":10.73,"BenchmarkDecodeBase58_B_op":0,"BenchmarkDecodeBase58_allocs_op":0,"BenchmarkEncodeBase58_ns_op":21.02,"BenchmarkEncodeBase58_B_op":24,"BenchmarkEncodeBase58_allocs_op":1,"BenchmarkEncodeDecodeBase58_ns_op":31.18,"BenchmarkEncodeDecodeBase58_B_op":24,"BenchmarkEncodeDecodeBase58_allocs_op":1,"BenchmarkFromTime_ns_op":63.59,"BenchmarkFromTime_B_op":0,"BenchmarkFromTime_allocs_op":0,"BenchmarkGenerateUUID_ns_op":511.4,"BenchmarkGenerateUUID_B_op":24,"BenchmarkGenerateUUID_allocs_op":1,"BenchmarkMainGenerate_ns_op":509,"BenchmarkMainGenerate_B_op":24,"BenchmarkMainGenerate_allocs_op":1,"BenchmarkMainHelp_ns_op":365.9,"BenchmarkMainHelp_B_op":0,"BenchmarkMainHelp_allocs_op":0,"BenchmarkMainParse_ns_op":486.7,"BenchmarkMainParse_B_op":0,"BenchmarkMainParse_allocs_op":0,"BenchmarkNewString_ns_op":131.1,"BenchmarkNewString_B_op":24,"BenchmarkNewString_allocs_op":1,"BenchmarkParseUUID_ns_op":486.5,"BenchmarkParseUUID_B_op":0,"BenchmarkParseUUID_allocs_op":0,"BenchmarkUUID7_ns_op":96.44,"BenchmarkUUID7_B_op":0,"BenchmarkUUID7_allocs_op":0},"status":"keep","description":"Decode Base58 in 58^4 chunks after a leading pair","timestamp":1782062783653,"segment":0,"confidence":8.022214297696312,"asi":{"hypothesis":"The fixed 22 Base58 digits can be decoded as one leading two-digit chunk followed by five 58^4 chunks, reducing multiply/carry updates versus the previous 11 pair updates while preserving left-to-right invalid digit errors and low-128-bit truncation semantics.","learned":"DecodeBase58 improved from ~13.6ns to ~10.7ns, and EncodeDecode improved to ~31ns. Correctness checks passed, so chunked decode is a general fixed-width optimization analogous to the 58^4 encoder."}}
{"run":48,"commit":"f68b464","metric":125.65492308605711,"metrics":{"BenchmarkDecodeBase58_ns_op":9.75,"BenchmarkDecodeBase58_B_op":0,"BenchmarkDecodeBase58_allocs_op":0,"BenchmarkEncodeBase58_ns_op":21.09,"BenchmarkEncodeBase58_B_op":24,"BenchmarkEncodeBase58_allocs_op":1,"BenchmarkEncodeDecodeBase58_ns_op":32.3,"BenchmarkEncodeDecodeBase58_B_op":24,"BenchmarkEncodeDecodeBase58_allocs_op":1,"BenchmarkFromTime_ns_op":63.62,"BenchmarkFromTime_B_op":0,"BenchmarkFromTime_allocs_op":0,"BenchmarkGenerateUUID_ns_op":516.1,"BenchmarkGenerateUUID_B_op":24,"BenchmarkGenerateUUID_allocs_op":1,"BenchmarkMainGenerate_ns_op":515.2,"BenchmarkMainGenerate_B_op":24,"BenchmarkMainGenerate_allocs_op":1,"BenchmarkMainHelp_ns_op":366.1,"BenchmarkMainHelp_B_op":0,"BenchmarkMainHelp_allocs_op":0,"BenchmarkMainParse_ns_op":488.1,"BenchmarkMainParse_B_op":0,"BenchmarkMainParse_allocs_op":0,"BenchmarkNewString_ns_op":131.4,"BenchmarkNewString_B_op":24,"BenchmarkNewString_allocs_op":1,"BenchmarkParseUUID_ns_op":485,"BenchmarkParseUUID_B_op":0,"BenchmarkParseUUID_allocs_op":0,"BenchmarkUUID7_ns_op":96.37,"BenchmarkUUID7_B_op":0,"BenchmarkUUID7_allocs_op":0},"status":"keep","description":"Unroll remaining fixed Base58 decode chunks","timestamp":1782062875026,"segment":0,"confidence":8.567548649306303,"asi":{"hypothesis":"After chunking DecodeBase58 into fixed 58^4 groups, the final loop always processes exactly three chunks at fixed positions. Unrolling those chunks should remove loop/index overhead while preserving left-to-right invalid digit validation and fixed-width semantics.","learned":"DecodeBase58 improved to ~9.75ns and primary geomean improved slightly to ~125.65. The gain is modest because decode is already very fast, but the fixed-position unroll passed correctness checks and is generally valid for every hqid7 string."}}
{"run":49,"commit":"00b1a0a","metric":124.43651524075342,"metrics":{"BenchmarkDecodeBase58_ns_op":9.747,"BenchmarkDecodeBase58_B_op":0,"BenchmarkDecodeBase58_allocs_op":0,"BenchmarkEncodeBase58_ns_op":21.48,"BenchmarkEncodeBase58_B_op":24,"BenchmarkEncodeBase58_allocs_op":1,"BenchmarkEncodeDecodeBase58_ns_op":31.8,"BenchmarkEncodeDecodeBase58_B_op":24,"BenchmarkEncodeDecodeBase58_allocs_op":1,"BenchmarkFromTime_ns_op":63.97,"BenchmarkFromTime_B_op":0,"BenchmarkFromTime_allocs_op":0,"BenchmarkGenerateUUID_ns_op":507.1,"BenchmarkGenerateUUID_B_op":24,"BenchmarkGenerateUUID_allocs_op":1,"BenchmarkMainGenerate_ns_op":507.9,"BenchmarkMainGenerate_B_op":24,"BenchmarkMainGenerate_allocs_op":1,"BenchmarkMainHelp_ns_op":356.2,"BenchmarkMainHelp_B_op":0,"BenchmarkMainHelp_allocs_op":0,"BenchmarkMainParse_ns_op":474.6,"BenchmarkMainParse_B_op":0,"BenchmarkMainParse_allocs_op":0,"BenchmarkNewString_ns_op":130.7,"BenchmarkNewString_B_op":24,"BenchmarkNewString_allocs_op":1,"BenchmarkParseUUID_ns_op":474.2,"BenchmarkParseUUID_B_op":0,"BenchmarkParseUUID_allocs_op":0,"BenchmarkUUID7_ns_op":96.38,"BenchmarkUUID7_B_op":0,"BenchmarkUUID7_allocs_op":0},"status":"keep","description":"Specialize parse output binary and hex append helpers","timestamp":1782062977276,"segment":0,"confidence":8.759984777762236,"asi":{"hypothesis":"The CLI parse output always renders 2 binary bits, 12 binary bits, and 15 hex digits. Replacing width-parameter loops with small fixed append helpers should reduce parse formatting overhead while preserving exact output for all values.","learned":"ParseUUID/MainParse improved from ~485ns to ~474ns and primary geomean improved to ~124.4. This is a general fixed-width formatting optimization, not tied to a particular input string."}}
{"run":50,"commit":"ec795a5","metric":122.6433560112672,"metrics":{"BenchmarkDecodeBase58_ns_op":9.529,"BenchmarkDecodeBase58_B_op":0,"BenchmarkDecodeBase58_allocs_op":0,"BenchmarkEncodeBase58_ns_op":20.92,"BenchmarkEncodeBase58_B_op":24,"BenchmarkEncodeBase58_allocs_op":1,"BenchmarkEncodeDecodeBase58_ns_op":29.4,"BenchmarkEncodeDecodeBase58_B_op":24,"BenchmarkEncodeDecodeBase58_allocs_op":1,"BenchmarkFromTime_ns_op":63.57,"BenchmarkFromTime_B_op":0,"BenchmarkFromTime_allocs_op":0,"BenchmarkGenerateUUID_ns_op":504.4,"BenchmarkGenerateUUID_B_op":24,"BenchmarkGenerateUUID_allocs_op":1,"BenchmarkMainGenerate_ns_op":506.5,"BenchmarkMainGenerate_B_op":24,"BenchmarkMainGenerate_allocs_op":1,"BenchmarkMainHelp_ns_op":357.4,"BenchmarkMainHelp_B_op":0,"BenchmarkMainHelp_allocs_op":0,"BenchmarkMainParse_ns_op":469.6,"BenchmarkMainParse_B_op":0,"BenchmarkMainParse_allocs_op":0,"BenchmarkNewString_ns_op":130.6,"BenchmarkNewString_B_op":24,"BenchmarkNewString_allocs_op":1,"BenchmarkParseUUID_ns_op":470.8,"BenchmarkParseUUID_B_op":0,"BenchmarkParseUUID_allocs_op":0,"BenchmarkUUID7_ns_op":96.13,"BenchmarkUUID7_B_op":0,"BenchmarkUUID7_allocs_op":0},"status":"keep","description":"Use zero-based Base58 decode table with 0xff invalid sentinel","timestamp":1782063171789,"segment":0,"confidence":8.969327112637643,"asi":{"hypothesis":"Changing the Base58 decode table to store zero-based digit values with 0xff as the invalid sentinel should remove repeated `-1` adjustments in the fixed chunk decoder while preserving invalid-character errors and output semantics.","learned":"Primary geomean improved to ~122.6, with DecodeBase58 slightly faster (~9.5ns) and downstream parse/encode-decode paths improving. The valid-path arithmetic is simpler; invalid handling still distinguishes high-bit bytes and reports the first invalid digit."}}
{"run":51,"commit":"dd30228","metric":122.02001095532387,"metrics":{"BenchmarkDecodeBase58_ns_op":8.349,"BenchmarkDecodeBase58_B_op":0,"BenchmarkDecodeBase58_allocs_op":0,"BenchmarkEncodeBase58_ns_op":21.07,"BenchmarkEncodeBase58_B_op":24,"BenchmarkEncodeBase58_allocs_op":1,"BenchmarkEncodeDecodeBase58_ns_op":30.93,"BenchmarkEncodeDecodeBase58_B_op":24,"BenchmarkEncodeDecodeBase58_allocs_op":1,"BenchmarkFromTime_ns_op":64.11,"BenchmarkFromTime_B_op":0,"BenchmarkFromTime_allocs_op":0,"BenchmarkGenerateUUID_ns_op":505.1,"BenchmarkGenerateUUID_B_op":24,"BenchmarkGenerateUUID_allocs_op":1,"BenchmarkMainGenerate_ns_op":508.6,"BenchmarkMainGenerate_B_op":24,"BenchmarkMainGenerate_allocs_op":1,"BenchmarkMainHelp_ns_op":357.1,"BenchmarkMainHelp_B_op":0,"BenchmarkMainHelp_allocs_op":0,"BenchmarkMainParse_ns_op":475.1,"BenchmarkMainParse_B_op":0,"BenchmarkMainParse_allocs_op":0,"BenchmarkNewString_ns_op":128.6,"BenchmarkNewString_B_op":24,"BenchmarkNewString_allocs_op":1,"BenchmarkParseUUID_ns_op":477.4,"BenchmarkParseUUID_B_op":0,"BenchmarkParseUUID_allocs_op":0,"BenchmarkUUID7_ns_op":95.65,"BenchmarkUUID7_B_op":0,"BenchmarkUUID7_allocs_op":0},"status":"keep","description":"Collapse Base58 decode invalid checks per fixed chunk","timestamp":1782063271736,"segment":0,"confidence":10.76852052627178,"asi":{"hypothesis":"With the 0xff invalid sentinel, valid Base58 decode chunks can check all digits with a single bitwise-OR comparison per fixed chunk, moving left-to-right error selection into a cold helper while preserving exact invalid digit behavior.","learned":"DecodeBase58 improved from ~9.5ns to ~8.35ns and primary geomean improved to ~122.0. The valid path now has far fewer predictable invalid checks while correctness checks still verify round trips and ordering."}}
{"run":52,"commit":"dd30228","metric":135.9304281234853,"metrics":{"BenchmarkDecodeBase58_ns_op":8.384,"BenchmarkDecodeBase58_B_op":0,"BenchmarkDecodeBase58_allocs_op":0,"BenchmarkEncodeBase58_ns_op":23.17,"BenchmarkEncodeBase58_B_op":24,"BenchmarkEncodeBase58_allocs_op":1,"BenchmarkEncodeDecodeBase58_ns_op":31.71,"BenchmarkEncodeDecodeBase58_B_op":24,"BenchmarkEncodeDecodeBase58_allocs_op":1,"BenchmarkFromTime_ns_op":63.69,"BenchmarkFromTime_B_op":0,"BenchmarkFromTime_allocs_op":0,"BenchmarkGenerateUUID_ns_op":861,"BenchmarkGenerateUUID_B_op":24,"BenchmarkGenerateUUID_allocs_op":1,"BenchmarkMainGenerate_ns_op":861.4,"BenchmarkMainGenerate_B_op":24,"BenchmarkMainGenerate_allocs_op":1,"BenchmarkMainHelp_ns_op":357.5,"BenchmarkMainHelp_B_op":0,"BenchmarkMainHelp_allocs_op":0,"BenchmarkMainParse_ns_op":469,"BenchmarkMainParse_B_op":0,"BenchmarkMainParse_allocs_op":0,"BenchmarkNewString_ns_op":130.9,"BenchmarkNewString_B_op":24,"BenchmarkNewString_allocs_op":1,"BenchmarkParseUUID_ns_op":473.6,"BenchmarkParseUUID_B_op":0,"BenchmarkParseUUID_allocs_op":0,"BenchmarkUUID7_ns_op":96.79,"BenchmarkUUID7_B_op":0,"BenchmarkUUID7_allocs_op":0},"status":"discard","description":"Split CLI generate output into two WriteString calls","timestamp":1782063346186,"segment":0,"confidence":11.945308110980061,"asi":{"hypothesis":"Writing the generated hqid7 string and newline separately might avoid any hidden concatenation cost while preserving exact CLI output.","rollback_reason":"Correctness checks passed, but primary geomean regressed badly. GenerateUUID/MainGenerate slowed to ~861ns because the extra write call dominates; the current single WriteString(base58String+\"\\n\") path is better even with one string allocation.","next_action_hint":"Keep the single WriteString with appended newline. Future generate work should avoid extra writes; if targeting zero allocations, use one buffered write without slowing EncodeBase58."}}
{"run":53,"commit":"dd30228","metric":122.67172640647608,"metrics":{"BenchmarkDecodeBase58_ns_op":8.393,"BenchmarkDecodeBase58_B_op":0,"BenchmarkDecodeBase58_allocs_op":0,"BenchmarkEncodeBase58_ns_op":21.06,"BenchmarkEncodeBase58_B_op":24,"BenchmarkEncodeBase58_allocs_op":1,"BenchmarkEncodeDecodeBase58_ns_op":31.83,"BenchmarkEncodeDecodeBase58_B_op":24,"BenchmarkEncodeDecodeBase58_allocs_op":1,"BenchmarkFromTime_ns_op":63.71,"BenchmarkFromTime_B_op":0,"BenchmarkFromTime_allocs_op":0,"BenchmarkGenerateUUID_ns_op":515.9,"BenchmarkGenerateUUID_B_op":24,"BenchmarkGenerateUUID_allocs_op":1,"BenchmarkMainGenerate_ns_op":517.7,"BenchmarkMainGenerate_B_op":24,"BenchmarkMainGenerate_allocs_op":1,"BenchmarkMainHelp_ns_op":362.8,"BenchmarkMainHelp_B_op":0,"BenchmarkMainHelp_allocs_op":0,"BenchmarkMainParse_ns_op":467.8,"BenchmarkMainParse_B_op":0,"BenchmarkMainParse_allocs_op":0,"BenchmarkNewString_ns_op":131,"BenchmarkNewString_B_op":24,"BenchmarkNewString_allocs_op":1,"BenchmarkParseUUID_ns_op":463.1,"BenchmarkParseUUID_B_op":0,"BenchmarkParseUUID_allocs_op":0,"BenchmarkUUID7_ns_op":96.04,"BenchmarkUUID7_B_op":0,"BenchmarkUUID7_allocs_op":0},"status":"discard","description":"Manually format UTC parse timestamp from milliseconds","timestamp":1782063436365,"segment":0,"confidence":11.925750145825889,"asi":{"hypothesis":"The UTC timestamp in parse output can be formatted directly from milliseconds using a civil-date algorithm, avoiding time.UTC().Date/Clock/Zone while falling back to time.AppendFormat for years outside the existing fixed-width formatting range.","rollback_reason":"Correctness checks passed and ParseUUID itself improved, but primary geomean regressed versus the current best because unrelated generate/help/encode-decode noise outweighed the parse gain. The added civil-date code is also more complex for a small and noisy benefit.","next_action_hint":"Do not keep this manual UTC formatter unless repeated runs show durable primary improvement; simpler parse optimizations or generate-path wins are preferable."}}
{"run":54,"commit":"dd30228","metric":122.40030535092818,"metrics":{"BenchmarkDecodeBase58_ns_op":8.291,"BenchmarkDecodeBase58_B_op":0,"BenchmarkDecodeBase58_allocs_op":0,"BenchmarkEncodeBase58_ns_op":21.16,"BenchmarkEncodeBase58_B_op":24,"BenchmarkEncodeBase58_allocs_op":1,"BenchmarkEncodeDecodeBase58_ns_op":31.91,"BenchmarkEncodeDecodeBase58_B_op":24,"BenchmarkEncodeDecodeBase58_allocs_op":1,"BenchmarkFromTime_ns_op":63.66,"BenchmarkFromTime_B_op":0,"BenchmarkFromTime_allocs_op":0,"BenchmarkGenerateUUID_ns_op":495.3,"BenchmarkGenerateUUID_B_op":0,"BenchmarkGenerateUUID_allocs_op":0,"BenchmarkMainGenerate_ns_op":498.1,"BenchmarkMainGenerate_B_op":0,"BenchmarkMainGenerate_allocs_op":0,"BenchmarkMainHelp_ns_op":364.2,"BenchmarkMainHelp_B_op":0,"BenchmarkMainHelp_allocs_op":0,"BenchmarkMainParse_ns_op":478.8,"BenchmarkMainParse_B_op":0,"BenchmarkMainParse_allocs_op":0,"BenchmarkNewString_ns_op":130.5,"BenchmarkNewString_B_op":24,"BenchmarkNewString_allocs_op":1,"BenchmarkParseUUID_ns_op":477.7,"BenchmarkParseUUID_B_op":0,"BenchmarkParseUUID_allocs_op":0,"BenchmarkUUID7_ns_op":96.66,"BenchmarkUUID7_B_op":0,"BenchmarkUUID7_allocs_op":0},"status":"discard","description":"Add AppendBase58 and use stack buffer for CLI generate without changing EncodeBase58","timestamp":1782063537414,"segment":0,"confidence":11.906256120209108,"asi":{"hypothesis":"An exported AppendBase58 that duplicates the current fast fixed-position encoder can let the CLI generate path write a single stack buffer plus newline, eliminating generate allocations without slowing the existing EncodeBase58 benchmark.","rollback_reason":"Correctness checks passed and GenerateUUID/MainGenerate dropped to zero allocations and ~495ns, but primary geomean regressed versus current best because EncodeDecode/parse/help noise and the extra code path did not produce a net primary improvement.","next_action_hint":"Do not keep AppendBase58 unless focusing specifically on CLI generate allocations. Primary metric currently favors the simpler EncodeBase58 + single WriteString path."}}
{"run":55,"commit":"dd30228","metric":122.58289246794274,"metrics":{"BenchmarkDecodeBase58_ns_op":8.298,"BenchmarkDecodeBase58_B_op":0,"BenchmarkDecodeBase58_allocs_op":0,"BenchmarkEncodeBase58_ns_op":20.87,"BenchmarkEncodeBase58_B_op":24,"BenchmarkEncodeBase58_allocs_op":1,"BenchmarkEncodeDecodeBase58_ns_op":30.77,"BenchmarkEncodeDecodeBase58_B_op":24,"BenchmarkEncodeDecodeBase58_allocs_op":1,"BenchmarkFromTime_ns_op":63.63,"BenchmarkFromTime_B_op":0,"BenchmarkFromTime_allocs_op":0,"BenchmarkGenerateUUID_ns_op":510.7,"BenchmarkGenerateUUID_B_op":24,"BenchmarkGenerateUUID_allocs_op":1,"BenchmarkMainGenerate_ns_op":514.7,"BenchmarkMainGenerate_B_op":24,"BenchmarkMainGenerate_allocs_op":1,"BenchmarkMainHelp_ns_op":364.9,"BenchmarkMainHelp_B_op":0,"BenchmarkMainHelp_allocs_op":0,"BenchmarkMainParse_ns_op":479.6,"BenchmarkMainParse_B_op":0,"BenchmarkMainParse_allocs_op":0,"BenchmarkNewString_ns_op":130.3,"BenchmarkNewString_B_op":24,"BenchmarkNewString_allocs_op":1,"BenchmarkParseUUID_ns_op":478.7,"BenchmarkParseUUID_B_op":0,"BenchmarkParseUUID_allocs_op":0,"BenchmarkUUID7_ns_op":96.53,"BenchmarkUUID7_B_op":0,"BenchmarkUUID7_allocs_op":0},"status":"discard","description":"Compute sub-millisecond nanoseconds via subtraction after quotient","timestamp":1782063611219,"segment":0,"confidence":11.60138856153235,"asi":{"hypothesis":"FromTime currently computes both quotient and remainder with division/modulo by time.Millisecond. Reusing the millisecond quotient and deriving the remainder via subtraction should preserve behavior (including Go's signed remainder semantics) while reducing timestamp arithmetic cost.","rollback_reason":"Correctness checks passed, but primary geomean regressed versus current best and FromTime/UUID7 did not improve materially; the compiler likely already optimizes division and remainder by the same constant together.","next_action_hint":"Keep the simple `/` and `%` timestamp arithmetic. Future generation improvements should target random-read/output overhead rather than quotient/remainder arithmetic."}}
{"run":56,"commit":"dd30228","metric":122.70355098936366,"metrics":{"BenchmarkDecodeBase58_ns_op":8.44,"BenchmarkDecodeBase58_B_op":0,"BenchmarkDecodeBase58_allocs_op":0,"BenchmarkEncodeBase58_ns_op":20.5,"BenchmarkEncodeBase58_B_op":24,"BenchmarkEncodeBase58_allocs_op":1,"BenchmarkEncodeDecodeBase58_ns_op":30.58,"BenchmarkEncodeDecodeBase58_B_op":24,"BenchmarkEncodeDecodeBase58_allocs_op":1,"BenchmarkFromTime_ns_op":63.65,"BenchmarkFromTime_B_op":0,"BenchmarkFromTime_allocs_op":0,"BenchmarkGenerateUUID_ns_op":512.7,"BenchmarkGenerateUUID_B_op":24,"BenchmarkGenerateUUID_allocs_op":1,"BenchmarkMainGenerate_ns_op":512.8,"BenchmarkMainGenerate_B_op":24,"BenchmarkMainGenerate_allocs_op":1,"BenchmarkMainHelp_ns_op":364.6,"BenchmarkMainHelp_B_op":0,"BenchmarkMainHelp_allocs_op":0,"BenchmarkMainParse_ns_op":475.2,"BenchmarkMainParse_B_op":0,"BenchmarkMainParse_allocs_op":0,"BenchmarkNewString_ns_op":132.9,"BenchmarkNewString_B_op":24,"BenchmarkNewString_allocs_op":1,"BenchmarkParseUUID_ns_op":481.3,"BenchmarkParseUUID_B_op":0,"BenchmarkParseUUID_allocs_op":0,"BenchmarkUUID7_ns_op":96.75,"BenchmarkUUID7_B_op":0,"BenchmarkUUID7_allocs_op":0},"status":"discard","description":"Reduce CLI parse stack output buffer from 320 to 304 bytes","timestamp":1782063691170,"segment":0,"confidence":11.412763396971304,"asi":{"hypothesis":"The CLI parse stack buffer is slightly larger than typical output; reducing it from 320 to 304 bytes might lower stack zeroing while retaining zero allocations for ordinary timestamp/zone outputs and falling back to append growth for unusually long zone names.","rollback_reason":"Correctness checks passed, but primary geomean regressed versus current best and ParseUUID itself worsened in this sample. The smaller buffer is not a reliable win and is less robust for longer zone names.","next_action_hint":"Keep the 320-byte parse output buffer; future parse work should target actual formatting/time costs rather than shaving stack buffer size further."}}
