{"type":"config","name":"Optimize hqid7 Go benchmark performance","metricName":"geomean_ns_op","metricUnit":"","bestDirection":"lower"}
{"run":1,"commit":"5a9dc79","metric":699.7193883366288,"metrics":{"BenchmarkDecodeBase58_ns_op":133.7,"BenchmarkDecodeBase58_B_op":48,"BenchmarkDecodeBase58_allocs_op":1,"BenchmarkEncodeBase58_ns_op":282.1,"BenchmarkEncodeBase58_B_op":48,"BenchmarkEncodeBase58_allocs_op":2,"BenchmarkEncodeDecodeBase58_ns_op":420.7,"BenchmarkEncodeDecodeBase58_B_op":96,"BenchmarkEncodeDecodeBase58_allocs_op":3,"BenchmarkFromTime_ns_op":122.7,"BenchmarkFromTime_B_op":48,"BenchmarkFromTime_allocs_op":3,"BenchmarkGenerateUUID_ns_op":893.2,"BenchmarkGenerateUUID_B_op":112,"BenchmarkGenerateUUID_allocs_op":6,"BenchmarkMainGenerate_ns_op":892.3,"BenchmarkMainGenerate_B_op":112,"BenchmarkMainGenerate_allocs_op":6,"BenchmarkMainHelp_ns_op":7792,"BenchmarkMainHelp_B_op":0,"BenchmarkMainHelp_allocs_op":0,"BenchmarkMainParse_ns_op":4660,"BenchmarkMainParse_B_op":192,"BenchmarkMainParse_allocs_op":10,"BenchmarkNewString_ns_op":465.1,"BenchmarkNewString_B_op":96,"BenchmarkNewString_allocs_op":5,"BenchmarkParseUUID_ns_op":4666,"BenchmarkParseUUID_B_op":192,"BenchmarkParseUUID_allocs_op":10,"BenchmarkUUID7_ns_op":161,"BenchmarkUUID7_B_op":48,"BenchmarkUUID7_allocs_op":3},"status":"keep","description":"Baseline benchmark across all Go benchmarks with median per benchmark and geomean primary metric","timestamp":1781984091944,"segment":0,"confidence":null,"asi":{"hypothesis":"Establish stable baseline for all existing benchmarks before applying optimizations.","baseline_observations":"CLI parse/help benchmarks dominate geomean; NewString combines UUID generation and Base58 encode. EncodeBase58 allocates twice due external encoder plus string concatenation/padding; UUID7/FromTime allocate via crypto/rand.Int and math/big."}}
{"run":2,"commit":"c80a530","metric":609.3731841528536,"metrics":{"BenchmarkDecodeBase58_ns_op":122.4,"BenchmarkDecodeBase58_B_op":48,"BenchmarkDecodeBase58_allocs_op":1,"BenchmarkEncodeBase58_ns_op":285.2,"BenchmarkEncodeBase58_B_op":48,"BenchmarkEncodeBase58_allocs_op":2,"BenchmarkEncodeDecodeBase58_ns_op":398.7,"BenchmarkEncodeDecodeBase58_B_op":96,"BenchmarkEncodeDecodeBase58_allocs_op":3,"BenchmarkFromTime_ns_op":65.25,"BenchmarkFromTime_B_op":0,"BenchmarkFromTime_allocs_op":0,"BenchmarkGenerateUUID_ns_op":824.9,"BenchmarkGenerateUUID_B_op":64,"BenchmarkGenerateUUID_allocs_op":3,"BenchmarkMainGenerate_ns_op":847.2,"BenchmarkMainGenerate_B_op":64,"BenchmarkMainGenerate_allocs_op":3,"BenchmarkMainHelp_ns_op":7973,"BenchmarkMainHelp_B_op":0,"BenchmarkMainHelp_allocs_op":0,"BenchmarkMainParse_ns_op":4686,"BenchmarkMainParse_B_op":192,"BenchmarkMainParse_allocs_op":10,"BenchmarkNewString_ns_op":396.6,"BenchmarkNewString_B_op":48,"BenchmarkNewString_allocs_op":2,"BenchmarkParseUUID_ns_op":4677,"BenchmarkParseUUID_B_op":192,"BenchmarkParseUUID_allocs_op":10,"BenchmarkUUID7_ns_op":97.82,"BenchmarkUUID7_B_op":0,"BenchmarkUUID7_allocs_op":0},"status":"keep","description":"Replace math/big rand.Int UUID randomness with rand.Read and integer sub-ms precision","timestamp":1781984183396,"segment":0,"confidence":null,"asi":{"hypothesis":"Avoid crypto/rand.Int's math/big allocation path and float math while preserving UUIDv7 variant/version/output semantics.","learned":"Large general win: FromTime/UUID7 now zero-allocation; NewString dropped from 5 to 2 allocs because generation no longer allocates. rand.Read 8 bytes then masks variant bits is more direct and uniform for rand_b than previous big.Int path."}}
{"run":3,"commit":"c80a530","metric":613.8557377954486,"metrics":{"BenchmarkDecodeBase58_ns_op":137.6,"BenchmarkDecodeBase58_B_op":48,"BenchmarkDecodeBase58_allocs_op":1,"BenchmarkEncodeBase58_ns_op":241,"BenchmarkEncodeBase58_B_op":24,"BenchmarkEncodeBase58_allocs_op":1,"BenchmarkEncodeDecodeBase58_ns_op":358,"BenchmarkEncodeDecodeBase58_B_op":72,"BenchmarkEncodeDecodeBase58_allocs_op":2,"BenchmarkFromTime_ns_op":71.27,"BenchmarkFromTime_B_op":0,"BenchmarkFromTime_allocs_op":0,"BenchmarkGenerateUUID_ns_op":823.9,"BenchmarkGenerateUUID_B_op":40,"BenchmarkGenerateUUID_allocs_op":2,"BenchmarkMainGenerate_ns_op":820.3,"BenchmarkMainGenerate_B_op":40,"BenchmarkMainGenerate_allocs_op":2,"BenchmarkMainHelp_ns_op":8416,"BenchmarkMainHelp_B_op":0,"BenchmarkMainHelp_allocs_op":0,"BenchmarkMainParse_ns_op":4974,"BenchmarkMainParse_B_op":192,"BenchmarkMainParse_allocs_op":10,"BenchmarkNewString_ns_op":366.8,"BenchmarkNewString_B_op":24,"BenchmarkNewString_allocs_op":1,"BenchmarkParseUUID_ns_op":4992,"BenchmarkParseUUID_B_op":192,"BenchmarkParseUUID_allocs_op":10,"BenchmarkUUID7_ns_op":106.4,"BenchmarkUUID7_B_op":0,"BenchmarkUUID7_allocs_op":0},"status":"checks_failed","description":"Direct fixed-width Base58 encoder reduced allocs but failed encode/decode/order tests; check output cap prevents pi crash on noisy failures","timestamp":1781993031936,"segment":0,"confidence":20.155074849583418,"asi":{"hypothesis":"Replacing base58.Encode with a one-allocation fixed-width encoder would reduce EncodeBase58/NewString allocations.","rollback_reason":"Correctness checks fail massively: encoded strings do not match vectors, DecodeBase58 round trips fail, and lexicographic ordering breaks. The noisy TestEncodeDecode loop produced gigabytes of stdout, which is the concrete trigger for pi's Invalid string length crash.","next_action_hint":"Keep the output-capped .auto/checks.sh; if revisiting direct Base58, implement canonical big-integer base conversion exactly or optimize around existing base58.Encode padding instead.","failure_output_bytes_before_cap":3377175635,"pi_crash_cause":"pi execCommand concatenates child stdout into a JS string; uncapped go test output exceeded V8 max string length at dist/core/exec.js stdout += data.toString()."}}
{"run":4,"commit":"446b01c","metric":534.9687432247858,"metrics":{"BenchmarkDecodeBase58_ns_op":138.2,"BenchmarkDecodeBase58_B_op":48,"BenchmarkDecodeBase58_allocs_op":1,"BenchmarkEncodeBase58_ns_op":307.6,"BenchmarkEncodeBase58_B_op":48,"BenchmarkEncodeBase58_allocs_op":2,"BenchmarkEncodeDecodeBase58_ns_op":449.2,"BenchmarkEncodeDecodeBase58_B_op":96,"BenchmarkEncodeDecodeBase58_allocs_op":3,"BenchmarkFromTime_ns_op":72.01,"BenchmarkFromTime_B_op":0,"BenchmarkFromTime_allocs_op":0,"BenchmarkGenerateUUID_ns_op":1256,"BenchmarkGenerateUUID_B_op":48,"BenchmarkGenerateUUID_allocs_op":2,"BenchmarkMainGenerate_ns_op":1258,"BenchmarkMainGenerate_B_op":48,"BenchmarkMainGenerate_allocs_op":2,"BenchmarkMainHelp_ns_op":388.1,"BenchmarkMainHelp_B_op":0,"BenchmarkMainHelp_allocs_op":0,"BenchmarkMainParse_ns_op":5055,"BenchmarkMainParse_B_op":192,"BenchmarkMainParse_allocs_op":10,"BenchmarkNewString_ns_op":441.5,"BenchmarkNewString_B_op":48,"BenchmarkNewString_allocs_op":2,"BenchmarkParseUUID_ns_op":5021,"BenchmarkParseUUID_B_op":192,"BenchmarkParseUUID_allocs_op":10,"BenchmarkUUID7_ns_op":108.7,"BenchmarkUUID7_B_op":0,"BenchmarkUUID7_allocs_op":0},"status":"keep","description":"Collapse CLI help output to a single constant WriteString and avoid fmt for generated ID newline","timestamp":1781993121753,"segment":0,"confidence":4.176877215528039,"asi":{"hypothesis":"printUsage currently performs many fmt.Println calls; replacing them with one constant WriteString preserves exact help text while avoiding repeated fmt dispatch and writes. Generated ID output may also avoid fmt overhead with WriteString.","learned":"The single constant usage write produced a very large general win for CLI help (about 8us to 0.39us). Generate path regressed in this sample likely due two direct writes/noise; primary geomean improved substantially because help was a dominant benchmark.","next_action_hint":"Consider testing whether generateUUID should use fmt.Println or a single write buffer rather than two WriteString calls; also optimize parseUUID output formatting/DecodeBase58 next."}}
{"run":5,"commit":"312f022","metric":418.52966860490386,"metrics":{"BenchmarkDecodeBase58_ns_op":136.9,"BenchmarkDecodeBase58_B_op":48,"BenchmarkDecodeBase58_allocs_op":1,"BenchmarkEncodeBase58_ns_op":306.6,"BenchmarkEncodeBase58_B_op":48,"BenchmarkEncodeBase58_allocs_op":2,"BenchmarkEncodeDecodeBase58_ns_op":448.2,"BenchmarkEncodeDecodeBase58_B_op":96,"BenchmarkEncodeDecodeBase58_allocs_op":3,"BenchmarkFromTime_ns_op":71.43,"BenchmarkFromTime_B_op":0,"BenchmarkFromTime_allocs_op":0,"BenchmarkGenerateUUID_ns_op":1246,"BenchmarkGenerateUUID_B_op":48,"BenchmarkGenerateUUID_allocs_op":2,"BenchmarkMainGenerate_ns_op":1256,"BenchmarkMainGenerate_B_op":48,"BenchmarkMainGenerate_allocs_op":2,"BenchmarkMainHelp_ns_op":392.3,"BenchmarkMainHelp_B_op":0,"BenchmarkMainHelp_allocs_op":0,"BenchmarkMainParse_ns_op":1327,"BenchmarkMainParse_B_op":192,"BenchmarkMainParse_allocs_op":10,"BenchmarkNewString_ns_op":442.7,"BenchmarkNewString_B_op":48,"BenchmarkNewString_allocs_op":2,"BenchmarkParseUUID_ns_op":1315,"BenchmarkParseUUID_B_op":192,"BenchmarkParseUUID_allocs_op":10,"BenchmarkUUID7_ns_op":108.3,"BenchmarkUUID7_B_op":0,"BenchmarkUUID7_allocs_op":0},"status":"keep","description":"Collapse parse output formatting into one Fprintf with shared time format constant","timestamp":1781993184348,"segment":0,"confidence":3.779206136412902,"asi":{"hypothesis":"parseUUID spends much of its time in many fmt.Print* calls and repeated parsing of the timestamp layout literal; one Fprintf with a shared layout constant should preserve exact CLI output while reducing dispatch and write overhead.","learned":"Large general win for CLI parse: BenchmarkParseUUID and BenchmarkMainParse dropped from ~5us to ~1.3us with unchanged allocation counts, confirming output call overhead dominated parse after DecodeBase58/time formatting.","next_action_hint":"Next promising areas: optimize DecodeBase58 allocation/path generally, or revisit generateUUID output to avoid the current two WriteString calls causing slower generate benchmarks."}}
{"run":6,"commit":"312f022","metric":457.8696521174635,"metrics":{"BenchmarkDecodeBase58_ns_op":248.6,"BenchmarkDecodeBase58_B_op":0,"BenchmarkDecodeBase58_allocs_op":0,"BenchmarkEncodeBase58_ns_op":310.5,"BenchmarkEncodeBase58_B_op":48,"BenchmarkEncodeBase58_allocs_op":2,"BenchmarkEncodeDecodeBase58_ns_op":536.1,"BenchmarkEncodeDecodeBase58_B_op":48,"BenchmarkEncodeDecodeBase58_allocs_op":2,"BenchmarkFromTime_ns_op":71.57,"BenchmarkFromTime_B_op":0,"BenchmarkFromTime_allocs_op":0,"BenchmarkGenerateUUID_ns_op":1281,"BenchmarkGenerateUUID_B_op":48,"BenchmarkGenerateUUID_allocs_op":2,"BenchmarkMainGenerate_ns_op":1279,"BenchmarkMainGenerate_B_op":48,"BenchmarkMainGenerate_allocs_op":2,"BenchmarkMainHelp_ns_op":397.2,"BenchmarkMainHelp_B_op":0,"BenchmarkMainHelp_allocs_op":0,"BenchmarkMainParse_ns_op":1448,"BenchmarkMainParse_B_op":144,"BenchmarkMainParse_allocs_op":9,"BenchmarkNewString_ns_op":427.8,"BenchmarkNewString_B_op":48,"BenchmarkNewString_allocs_op":2,"BenchmarkParseUUID_ns_op":1438,"BenchmarkParseUUID_B_op":144,"BenchmarkParseUUID_allocs_op":9,"BenchmarkUUID7_ns_op":108,"BenchmarkUUID7_B_op":0,"BenchmarkUUID7_allocs_op":0},"status":"discard","description":"Direct zero-allocation Base58 decode passed correctness but slowed primary geomean","timestamp":1781993289823,"segment":0,"confidence":3.6053179808897564,"asi":{"hypothesis":"Avoid DecodeBase58's separator-removal string allocation and base58.Decode output allocation by decoding the 22 Base58 digits directly into a UUID with a lookup table, preserving valid input behavior and using the dependency only for invalid-character errors.","rollback_reason":"Although correctness checks passed and allocations dropped to zero for DecodeBase58, the per-digit base256 loop was much slower (DecodeBase58 ~137ns to ~249ns, EncodeDecode ~448ns to ~536ns), increasing primary geomean versus the current best.","next_action_hint":"Do not use the naive direct decode algorithm. If revisiting decode, consider a faster chunked/base conversion or focus on reducing parse/output allocations elsewhere."}}
{"run":7,"commit":"9d1615a","metric":404.67021795633184,"metrics":{"BenchmarkDecodeBase58_ns_op":136,"BenchmarkDecodeBase58_B_op":48,"BenchmarkDecodeBase58_allocs_op":1,"BenchmarkEncodeBase58_ns_op":307.8,"BenchmarkEncodeBase58_B_op":48,"BenchmarkEncodeBase58_allocs_op":2,"BenchmarkEncodeDecodeBase58_ns_op":441.6,"BenchmarkEncodeDecodeBase58_B_op":96,"BenchmarkEncodeDecodeBase58_allocs_op":3,"BenchmarkFromTime_ns_op":73.39,"BenchmarkFromTime_B_op":0,"BenchmarkFromTime_allocs_op":0,"BenchmarkGenerateUUID_ns_op":981.3,"BenchmarkGenerateUUID_B_op":64,"BenchmarkGenerateUUID_allocs_op":3,"BenchmarkMainGenerate_ns_op":931.7,"BenchmarkMainGenerate_B_op":64,"BenchmarkMainGenerate_allocs_op":3,"BenchmarkMainHelp_ns_op":409.8,"BenchmarkMainHelp_B_op":0,"BenchmarkMainHelp_allocs_op":0,"BenchmarkMainParse_ns_op":1338,"BenchmarkMainParse_B_op":192,"BenchmarkMainParse_allocs_op":10,"BenchmarkNewString_ns_op":469.4,"BenchmarkNewString_B_op":48,"BenchmarkNewString_allocs_op":2,"BenchmarkParseUUID_ns_op":1367,"BenchmarkParseUUID_B_op":192,"BenchmarkParseUUID_allocs_op":10,"BenchmarkUUID7_ns_op":109.2,"BenchmarkUUID7_B_op":0,"BenchmarkUUID7_allocs_op":0},"status":"keep","description":"Restore fmt.Printf for generated ID output after two WriteString calls proved slower","timestamp":1781993340738,"segment":0,"confidence":3.7401497165164233,"asi":{"hypothesis":"The prior CLI help optimization also changed generateUUID to two os.Stdout.WriteString calls; despite fewer allocations, two interface method calls/writes may be slower than the original single fmt.Printf. Restoring fmt.Printf should improve generate benchmarks without changing output.","learned":"Restoring fmt.Printf improved GenerateUUID/MainGenerate substantially versus the current best sample (about 1.25us to 0.93-0.98us) and improved primary geomean to ~404.7 despite one extra allocation in the CLI generate path.","next_action_hint":"Try a single WriteString(base58String+\"\\n\") or preallocated []byte write as alternatives to see if single syscall/write with less fmt overhead can beat fmt.Printf while preserving output."}}
{"run":8,"commit":"4a092dc","metric":396.479805192504,"metrics":{"BenchmarkDecodeBase58_ns_op":136.9,"BenchmarkDecodeBase58_B_op":48,"BenchmarkDecodeBase58_allocs_op":1,"BenchmarkEncodeBase58_ns_op":316.7,"BenchmarkEncodeBase58_B_op":48,"BenchmarkEncodeBase58_allocs_op":2,"BenchmarkEncodeDecodeBase58_ns_op":447.6,"BenchmarkEncodeDecodeBase58_B_op":96,"BenchmarkEncodeDecodeBase58_allocs_op":3,"BenchmarkFromTime_ns_op":72.25,"BenchmarkFromTime_B_op":0,"BenchmarkFromTime_allocs_op":0,"BenchmarkGenerateUUID_ns_op":901.3,"BenchmarkGenerateUUID_B_op":48,"BenchmarkGenerateUUID_allocs_op":2,"BenchmarkMainGenerate_ns_op":898.1,"BenchmarkMainGenerate_B_op":48,"BenchmarkMainGenerate_allocs_op":2,"BenchmarkMainHelp_ns_op":398.4,"BenchmarkMainHelp_B_op":0,"BenchmarkMainHelp_allocs_op":0,"BenchmarkMainParse_ns_op":1331,"BenchmarkMainParse_B_op":192,"BenchmarkMainParse_allocs_op":10,"BenchmarkNewString_ns_op":442.9,"BenchmarkNewString_B_op":48,"BenchmarkNewString_allocs_op":2,"BenchmarkParseUUID_ns_op":1322,"BenchmarkParseUUID_B_op":192,"BenchmarkParseUUID_allocs_op":10,"BenchmarkUUID7_ns_op":108,"BenchmarkUUID7_B_op":0,"BenchmarkUUID7_allocs_op":0},"status":"keep","description":"Use one WriteString call with appended newline for generated ID output","timestamp":1781993387539,"segment":0,"confidence":3.1638808308952213,"asi":{"hypothesis":"A single os.Stdout.WriteString(base58String+\"\\n\") should preserve exact generate output while avoiding fmt.Printf overhead and avoiding the two separate writes that previously regressed generate performance.","learned":"Single WriteString with concatenated newline improved GenerateUUID/MainGenerate versus restored fmt.Printf and reduced allocations back to two; primary geomean improved to ~396.5 despite small noise in encode metrics.","next_action_hint":"Consider a zero-extra-allocation single os.Stdout.Write over a stack [24]byte built from the encoded string plus newline, or focus on EncodeBase58 allocation count."}}
{"run":9,"commit":"efc026a","metric":380.68737162626985,"metrics":{"BenchmarkDecodeBase58_ns_op":138.9,"BenchmarkDecodeBase58_B_op":48,"BenchmarkDecodeBase58_allocs_op":1,"BenchmarkEncodeBase58_ns_op":276.8,"BenchmarkEncodeBase58_B_op":24,"BenchmarkEncodeBase58_allocs_op":1,"BenchmarkEncodeDecodeBase58_ns_op":414.2,"BenchmarkEncodeDecodeBase58_B_op":72,"BenchmarkEncodeDecodeBase58_allocs_op":2,"BenchmarkFromTime_ns_op":72.32,"BenchmarkFromTime_B_op":0,"BenchmarkFromTime_allocs_op":0,"BenchmarkGenerateUUID_ns_op":832.4,"BenchmarkGenerateUUID_B_op":24,"BenchmarkGenerateUUID_allocs_op":1,"BenchmarkMainGenerate_ns_op":855.1,"BenchmarkMainGenerate_B_op":24,"BenchmarkMainGenerate_allocs_op":1,"BenchmarkMainHelp_ns_op":397.2,"BenchmarkMainHelp_B_op":0,"BenchmarkMainHelp_allocs_op":0,"BenchmarkMainParse_ns_op":1326,"BenchmarkMainParse_B_op":192,"BenchmarkMainParse_allocs_op":10,"BenchmarkNewString_ns_op":397.5,"BenchmarkNewString_B_op":24,"BenchmarkNewString_allocs_op":1,"BenchmarkParseUUID_ns_op":1324,"BenchmarkParseUUID_B_op":192,"BenchmarkParseUUID_allocs_op":10,"BenchmarkUUID7_ns_op":107.1,"BenchmarkUUID7_B_op":0,"BenchmarkUUID7_allocs_op":0},"status":"keep","description":"Implement correct direct fixed-width Base58 encoder with one string allocation","timestamp":1781993471298,"segment":0,"confidence":4.1379478295829015,"asi":{"hypothesis":"A correct direct Base58 encoder can preserve the exact 22-character padded hqid7 format while avoiding base58.Encode's intermediate result allocation and the padding/separator concatenation allocations.","learned":"The corrected little-endian base58 conversion passed the full high-coverage encode/order tests and reduced EncodeBase58/NewString/GenerateUUID allocations to one. This contrasts with the earlier failed fixed-width encoder; the key fix was building little-endian base58 digits and reversing them into a padded raw buffer.","next_action_hint":"Next explore small encode micro-optimizations (combine raw/out buffers, avoid copy loops) or parse output allocation reductions; avoid the previously discarded naive direct decoder."}}
{"run":10,"commit":"efc026a","metric":381.0850420915975,"metrics":{"BenchmarkDecodeBase58_ns_op":137.3,"BenchmarkDecodeBase58_B_op":48,"BenchmarkDecodeBase58_allocs_op":1,"BenchmarkEncodeBase58_ns_op":277.8,"BenchmarkEncodeBase58_B_op":24,"BenchmarkEncodeBase58_allocs_op":1,"BenchmarkEncodeDecodeBase58_ns_op":415.8,"BenchmarkEncodeDecodeBase58_B_op":72,"BenchmarkEncodeDecodeBase58_allocs_op":2,"BenchmarkFromTime_ns_op":72.62,"BenchmarkFromTime_B_op":0,"BenchmarkFromTime_allocs_op":0,"BenchmarkGenerateUUID_ns_op":835.2,"BenchmarkGenerateUUID_B_op":24,"BenchmarkGenerateUUID_allocs_op":1,"BenchmarkMainGenerate_ns_op":832.1,"BenchmarkMainGenerate_B_op":24,"BenchmarkMainGenerate_allocs_op":1,"BenchmarkMainHelp_ns_op":404.5,"BenchmarkMainHelp_B_op":0,"BenchmarkMainHelp_allocs_op":0,"BenchmarkMainParse_ns_op":1338,"BenchmarkMainParse_B_op":192,"BenchmarkMainParse_allocs_op":10,"BenchmarkNewString_ns_op":399.7,"BenchmarkNewString_B_op":24,"BenchmarkNewString_allocs_op":1,"BenchmarkParseUUID_ns_op":1314,"BenchmarkParseUUID_B_op":192,"BenchmarkParseUUID_allocs_op":10,"BenchmarkUUID7_ns_op":108.2,"BenchmarkUUID7_B_op":0,"BenchmarkUUID7_allocs_op":0},"status":"discard","description":"Fill final Base58 output buffer directly instead of using raw buffer and copy","timestamp":1781993543335,"segment":0,"confidence":5.566442034379144,"asi":{"hypothesis":"Avoid the intermediate raw [22]byte and two copy calls in EncodeBase58 by initializing the final [23]byte output with padding and writing reversed base58 digits around the separator directly.","rollback_reason":"Correctness checks passed, but primary geomean was slightly worse than the current best (381.09 vs 380.69). EncodeBase58 and NewString were marginally slower, likely because the extra branch/index mapping in the digit placement loop outweighed removing raw buffer copies.","next_action_hint":"Keep the simpler raw+copy encoder. Future encode attempts should target the base conversion loop rather than final buffer assembly, or improve parse/generate paths."}}
